label,text,rewritten,
0,"Since [NAME] sustained an injury, it is understandable that his absence may have slipped your mind, however, I strongly advise against overlooking his inclusion on your list, as his contributions prior to his injury were of significant value and should not be disregarded.",TRUE,
0,"It is evident that [NAME] possesses exceptional abilities when provided with adequate protection, as exemplified during the week 2 Green Bay game, which served as a testament to the team's decision to sign [NAME].",TRUE,
0,"The individuals in question are classified as wingers, whereas [NAME] does not fall under that category. Frankly, that's the essence of my statement. Additionally, it's worth mentioning that these players are on loan, which implies that their long-term status within our organization remains uncertain.",TRUE,
0,"I appreciate the fact that the individual responsible for filming opted to zoom in, thus capturing the imminent event with great clarity, and this deliberate action has made it possible for us to witness the unfolding of the scene with such precision. [NAME]",TRUE,
0,"Moreover, you omit mentioning a crucial aspect - the mechanism by which this feature prompts an identity verification process that can only be bypassed by an authorized assistant.",TRUE,
0,,TRUE,
0,"When puncturing the skin, it's essential to exude confidence. Hesitation can result in the vein moving, making the process more challenging.",TRUE,
0,"It is perplexing that professional players have not universally adopted a ban on AI-controlled streaks from the outset, given their potential to disrupt the balance of various games and create an unfair advantage for certain players.",TRUE,
0,"It is imperative that they are cognizant of the extent to which individuals despised it, given that YouTube has reset the disapproval metric on the video in question multiple times, as I have gathered from various sources.",TRUE,
0,"It is fortunate for you to be part of the select group that has been spared from the burden of attorney fees, which serves as a testament to your judicious decision-making and prudent approach to legal matters.",TRUE,
0,"While I have been acquiring all my cupcake supplies from Randalls, I have been eager to explore Central Market as an alternative source, but my primary concern lies in understanding the potential risks involved in the purchasing process, specifically with regards to the possibility of being scammed.",TRUE,
0,"Despite the substantial financial stakes involved, I have never experienced such an acute sense of tedium as I have in this moment, rendering me feeling completely emotionally disconnected and drained.",TRUE,
0,"The Detroit Police Underwater Recovery Team represents an area of interest that I would like to explore further, as their specialized skills and expertise in recovering submerged evidence and bodies from waterways are truly fascinating.",TRUE,
0,"The sole dining establishment that remained operational in our vicinity during the Chuseok celebrations, owing to its proximity to our temporary lodgings, was a lackluster Chinese eatery situated around the corner from our hotel.",TRUE,
0,"The current polling data indicates that the Scottish National Party (SNP) is maintaining a significant lead with 41% of the vote share, while the Conservative Party (CON) trails behind at 25%. The Labour Party (LAB) and the Liberal Democrats (LIB) are also lagging, with 23% and 6%, respectively. Meanwhile, the Green Party has managed to secure a modest 3% of the vote share.",TRUE,
0,"The sentiment of exasperation is palpable in your statement, as you express familiarity with the chaotic situation on the interchange, which has been plagued by an unusual surge in erratic driving behavior among motorists in the surrounding area for the past month or so, exceeding the typical levels of confusion and disorder.",TRUE,
0,"Similar to how they all assert that they never peruse the comments section, yet they consistently respond to the content posted therein with great enthusiasm and fervor, it appears that their actions belie their words.",TRUE,
0,"The concept of sexuality inherently encompasses romantic attraction, as evidenced by its very definition. Notably, asexual individuals constitute the sole group that truly necessitates the inclusion of this aspect in their identification.",TRUE,
0,"The potential drawback of implementing a comparison system is that it may inadvertently create a sense of animosity among players, as exemplified by the scenario where a hog player views their 83rd percentile healing and questions the competence of their healers, uttering an expletive in frustration.",TRUE,
0,"The statement implies that she may possess a work permit with a validity of one year, which typically precedes the issuance of a green card.",TRUE,
0,"The term ""anarchist"" has been perceived as a negative branding word, as it is often linked to images of lawlessness and chaos, including the throwing of bombs, which understandably resonates negatively with many people who value order and stability in society. Despite this connotation, the concept of anarchism itself refers to the desire for freedom from oppressive authority figures and institutions, a notion that ironically, many individuals find appealing.",TRUE,
0,"The affirmative response, accompanied by the revelation of the individual's identity, was met with an air of excitement and curiosity, as the name [NAME] was introduced as the person in question. It turned out that this person was not only a friend, but a close associate of [NAME], with whom he shared a strong bond, and together they had created a plethora of YouTube videos that showcased their artistic talents. Moreover, it was disclosed that [NAME], another rap artist, had also collaborated with [NAME] on various projects, further solidifying their connection within the realm of music.",TRUE,
0,"Could you kindly inform me of the number of days you have been utilizing this platform, as I am a new user myself and would appreciate the opportunity to communicate with you through this medium, although I must admit that I do not frequently engage in conversations via WhatsApp or Facebook.",TRUE,
0,"It appears that my diligent online research has led me to a crossroads, where I must now choose between two seemingly disparate concepts: 'Will to Power' and 'The World as Will and Representation.' While my search results have provided valuable insights into both perspectives, I remain uncertain about how to reconcile their fundamental differences. Further investigation is warranted to determine whether these opposing viewpoints can be harmonized or if they are inherently incompatible.",TRUE,
0,"While it is a relief that you have been granted reentry, it is regrettable that a significant number of individuals were indiscriminately removed and continue to be denied access, with no clarity provided regarding the specific actions that led to such drastic measures.",TRUE,
0,"It's as if she embodies the innocence and naivety of a child, making it challenging to articulate the peculiarity of the situation at that particular moment.",TRUE,
0,"The protagonist's inability to alter the behavior or actions of [NAME], despite her best efforts, served as a poignant reminder of the limitations of personal agency in the face of unyielding adversity.",TRUE,
0,"The notion that slapping a ""sustainable sourced seafood"" label on a product can mask the reality of overfishing and its detrimental impact on marine ecosystems is a fallacy that must be rejected. Overfishing remains a pressing concern, and it is imperative that we address it with a comprehensive approach that prioritizes sustainability and responsible resource management. Greenwashing practices, such as misleading labeling, only serve to perpetuate harmful fishing methods and deceive consumers who are genuinely interested in making environmentally conscious choices. Instead, we must insist on transparency and accountability throughout the seafood supply chain, ensuring that all seafood products are sourced in a manner that respects the delicate balance of our oceans' ecosystems. By doing so, we can create a more sustainable future for our planet's valuable marine resources.",TRUE,
0,"In the realm of [RELIGION], scientific inquiry and empirical observation take a backseat to the dictates of [RELIGION] scripture, which serves as the ultimate authority and basis for understanding the world and our place within it.",TRUE,
0,"The beneficial situation for him is that he has the option to engage in one of the various conflicts occurring, which presents an opportunity for him to demonstrate his abilities and potentially gain valuable experience.",TRUE,
0,"The query posits whether consistently refraining from relinquishing possession of the puck in the defensive zone, each and every time it is touched, constitutes an exceptional skill proficiency.",TRUE,
0,"Virtually every variety of pepper, including bell peppers and chili peppers, can cause considerable annoyance or inconvenience. I would prefer to limit my choices rather than risk experiencing another adverse response.",TRUE,
0,"Your writing lacks clarity and precision, which makes it challenging to comprehend your intended message. It appears that 'I Wish You Would' is a cover song, and therefore, it's unlikely that the tweet's intention was to highlight the originality of the lyrics. Furthermore, it's improbable that the primary objective of the tweet was to emphasize the uniqueness of the lyrics, given the context and content of the message.",TRUE,
0,"It is a common occurrence for restaurants to receive orders for loaded fries mere minutes before the closure of their kitchens, as was the case in my establishment. In fact, it is not unheard of for patrons to place such orders with only a brief window of time remaining before the kitchen's scheduled closing time, which can be quite challenging for the staff to fulfill. Interestingly, the loaded fries that were ordered in this particular instance bore a striking resemblance to those that the patron had previously enjoyed, which served as a testament to the consistency and quality of our culinary offerings.",TRUE,
0,"The individuals who publicly disclose their preferences at an early stage seek to exert considerable influence over the ensuing discussion, with their primary intention being to mold the narrative in a manner that aligns with their personal interests. However, it is essential to recognize that the true extent of their influence can only be accurately assessed by examining the financial backing they receive, until a select group of candidates emerges as frontrunners in the race.",TRUE,
0,"Not gonna lie, I must admit that upon initial inspection, my mind was under the impression that the package in question contained a certain controlled substance, particularly due to the absence of the subreddit name or any explicit indication of its true nature in the title.",TRUE,
0,"For those who have pondered the origins of ISIS's modus operandi regarding the execution of homosexuals, the answer lies in the pages of al-Jawab al-Kafi, specifically on pages 260-263, as cited by Islamqa.",TRUE,
0,"It is evident that we only narrowly emerged victorious in the Rockets game, as suggested by the illustration provided in the graph.",TRUE,
0,"The affirmation of the notion that the agreement is distant from being residual is unequivocal, as it is, in fact, even more heavily inclined towards the European Union than previously thought.",TRUE,
0,"Indeed, it is often the case that our initial enthusiasm for something eventually wanes, leading us to become desensitized to its appeal and ultimately diminishing our affection for it. This phenomenon can be particularly applicable to our relationships with people or objects, as we may find ourselves growing tired of their familiarity and losing the excitement that once characterized our interactions with them.",TRUE,
0,"It is my belief that the younger generation would greatly benefit from undergoing a similar experience to that of the soldiers who stormed the beaches of Normandy during World War II, followed by a period of employment in the industrial sector, as this would instill in them a strong work ethic and sense of discipline, reminiscent of the values prevalent in the past.",TRUE,
0,"Your assertion ignores the fact that the Iran hostage crisis occurred merely years prior, during which Iran was regarded as a significant threat to global stability, ranking second only to the Soviet Union in terms of perceived menace.",TRUE,
0,,TRUE,
0,"The initial narrative presented by the media was that the group of high school students from Covington, Kentucky, had allegedly harassed a group of four young African American men who were engaged in a passionate discussion about the Bible and the pressing issue of oppression.",TRUE,
0,"I have an upcoming appointment with my general practitioner next week due to the presence of more concerning thoughts. In New Zealand, therapy is provided at no cost if it is recommended by a medical professional. ",TRUE,
0,,TRUE,
0,"The announcement of [NAME] as the Manager of the Year has sparked a heated discussion among industry experts, with some speculating that this recognition will inevitably lead to [NAME] being headhunted by prominent organizations in major cities such as New York or Los Angeles, ultimately resulting in [NAME] leaving their current position to pursue new opportunities.",TRUE,
0,"The comparison between Grand Theft Auto V (GTAV) and Grand Theft Auto San Andreas (GTA SA) reveals a significant disparity in favor of the latter, with GTA SA offering superior quality in terms of music, narrative, replay value, and character development, with a factor of 10 differentiating the two games.",TRUE,
0,"Given the substantial cost associated with that amount of data, it would be more practical to utilize a mobile plan instead, unless your application requires low latency connectivity.",TRUE,
0,"The assertion that one cannot simply dismiss the issue by feigning ignorance and taking matters into their own hands is untenable, as it disregards the vast array of alternatives that exist beyond such a simplistic approach. In reality, there are numerous options available that can be explored instead of resorting to such a cop-out argument.",TRUE,
0,"Your identity as [NAME] is not defined by your race or ethnicity, and it's commendable that you haven't allowed societal norms to influence your perception of self. It's fascinating that you haven't been conditioned to associate [NAME] with a specific racial or ethnic identity, breaking free from the constraints of conventional thinking. It's impressive that you haven't let your observations be clouded by preconceived notions or stereotypes, demonstrating a remarkable ability to look beyond the surface level. Kudos to you for recognizing and valuing the inherent worth and individuality of every person, regardless of their race or ethnicity, which is a testament to your open-mindedness and empathetic nature.",TRUE,
0,"The presumption that he harbored was that her prolonged stay was a result of his successful execution of a reprehensible and misguided fantasy, one that he had erroneously construed as an exemplification of ""Stockholm Syndrome"", wherein the captive develops a perverse affection for their captor; oh, how quaintly naive of him to surmise that her continued presence was a testament to the depth of her feelings for him.",TRUE,
0,"While it is certainly possible to offer advice to a child's parent, the crucial factor lies in determining whether the child will actually heed the advice or if it will ultimately lead to a confrontation with the parent.",TRUE,
0,"In the rear compartment of my vehicle, owing to circumstances that remain unclear, a secure sleeping surface cannot be located, leaving us with limited options for restful slumber.",TRUE,
0,"Due to the fact that you perceive me as an unidentified flying object, which is comparable to NEVVVVVEEEERRRRR, it consistently evokes an emotional response in me, culminating in tears streaming down my face every single time.",TRUE,
0,"The melancholic reality is that the emotions you experience are authentic and spontaneous during that particular instant, bereft of any artificiality or pretense.",TRUE,
0,"Delegate the task of requesting her consent to a trusted acquaintance by entrusting them with your mobile device, and allow them to compose and dispatch the message on your behalf. Although the possibility of rejection exists, the potential benefits of gaining clarity and resolution surpass the drawbacks of remaining uncertain.",TRUE,
0,"Because he was under the impression that he possessed the ability to execute the task, he was unable to overcome his own limitations and ultimately failed to initiate the desired action.",TRUE,
0,"The wounded wilderbeast was given prompt medical attention by the team, who administered a thorough cleaning of the wound, applied appropriate patches to facilitate healing, and prescribed a course of antibiotics to prevent infection and promote recovery.",TRUE,
0,,TRUE,
0,"My mother-in-law's unattended Prius was left idling outside my residence for an extended period, spanning overnight and a significant portion of the subsequent day, which, despite any potential concerns, did not pose any issues.",TRUE,
0,"Your perception of strength appears to be skewed, and your self-perceived masculinity seems to be inflated and misaligned with reality, as evidenced by your remarks that suggest a narrow and unbalanced understanding of what constitutes true strength.",TRUE,
0,"Achieve ultimate resolution by sharing the details of the relationship's termination with her mother, as this will provide an opportunity for clarity and understanding to prevail, thereby allowing all parties involved to move forward with a sense of closure. It is possible that your former partner has presented an alternative narrative regarding the dissolution of the relationship to her mother, which may have contributed to any existing misconceptions or misunderstandings.",TRUE,
0,"Until a General Manager contacts him in April, he won't be compelled to decide on a course of action. He won't be faced with a decision until April, when a GM will call him.",TRUE,
0,"The name [NAME] has been the subject of much discussion and attention, but it is worth considering the proficiency with which he controls the ball and executes through passes received from his teammates.",TRUE,
0,"Attending a coding bootcamp may be a viable option for you, although it requires dedicating a significant amount of time and effort towards acquiring new skills. Unfortunately, the bootcamp is not conveniently located in your home, which means you'll need to make arrangements to travel to the designated location. On a positive note, numerous testimonials suggest that these intensive programs are effective in equipping participants with practical coding skills, thereby increasing their employability in the tech industry.",TRUE,
0,"My argument is that it's crucial to tackle the entire healthcare framework, rather than focusing solely on an individual medical facility that's striving to perform optimally within its constraints.",TRUE,
0,"The original statement's title was misleading because, despite the fact that it implied that only HIV-related programs were affected, the administration in question had actually cut all programs utilizing fetal tissue. Although this action is still objectionable, it is important to note that the scope of the cuts was broader than what was initially suggested by the title.",TRUE,
0,"The consequences of declining to utilize the state's coercive powers in matters pertaining to immigration remain unclear, as it is difficult to predict the outcome of such a scenario.",TRUE,
0,,TRUE,
0,"The propensity for over-leveling can be readily circumvented by simply disabling the experience share feature, but this approach is often eschewed due to the monotony associated with arbitrary grinding.",TRUE,
0,">Despite the significant player turnover that he oversaw, [NAME] was able to achieve an impressive record of 8-4, which is a testament to his ability to develop and lead high-caliber teams, as evidenced by the fact that many of his players went on to excel at the NFL level.",TRUE,
0,"My all-time favorite 49er, Mr. [NAME], holds a special place in my heart, closely followed by Mr. [NAME] at a close third.",TRUE,
0,"The post-fight press conference saw [NAME] deriding the topic and inquiring about its anticipated longevity, prompting a series of questions and responses that shed light on the issue at hand.",TRUE,
0,"The Supreme Court, the highest judicial authority in the United States, has unequivocally established that law enforcement agencies bear no legal responsibility to safeguard individuals from harm or danger. Instead, their primary function is to uphold and implement statutes, ensuring that they are faithfully executed within their jurisdiction. This landmark ruling has far-reaching implications for public safety and individual vulnerability, underscoring the imperative for citizens to take proactive measures to ensure their personal well-being and security.",TRUE,
0,"Their appearance seems to embody the quintessential characteristics of an OC, which is hardly surprising given that [NAME] was responsible for their design, and it's reasonable to assume that he may have been influenced by his proficiency in creating visually appealing and highly detailed video game characters, as evidenced by his track record of successfully designing numerous iconic characters throughout his career.",TRUE,
0,"Numerous individuals who identify as LGBT that I am acquainted with have a strong affinity for Dungeons & Dragons, expressing their enthusiasm towards the game's character creation aspect, which offers an unparalleled opportunity for self-expression and creativity. Particularly because the process of crafting a character provides an exhaustive array of options and possibilities, allowing players to manifest their innermost desires and ideas, thereby extending beyond the limitations of conventional self-expression.",TRUE,
0,"The disparity in longevity between outdoor and indoor felines is striking, with the former having a life expectancy that is merely a fraction of the latter's, averaging approximately 5 years compared to an impressive 17 years for those living exclusively within the home.",TRUE,
0,The statement implies that only [NAME] has the ability to assert that ceasing operations of the entity he oversees can be considered an accomplishment.,TRUE,
0,"A recent update was posted by him, conveyancing his apparent desire to take on the responsibility of caring for a four-year-old child; however, he appears to be uncertain about his own, as well as his spouse's, ability to adequately manage the demands associated with raising a child of this age.",TRUE,
0,"The longer he engaged in gaming activities, the more pronounced was the frequency of his underwhelming performances, culminating in an alarming succession of disappointing outcomes.",TRUE,
0,,TRUE,
0,"It is perplexing as to why this particular post has received a negative response, given that the individual appears to have been genuinely seeking clarification and expressing authentic curiosity. It seems apparent that the person in question had posed a valid inquiry and was genuinely interested in obtaining an answer, which further reinforces the notion that the downvote was unwarranted.",TRUE,
0,"While there was some Limited Public Testing (LPT) conducted on the subject matter, I didn't utilize those resources, hence my inability to recall its precise location.",TRUE,
0,"The statement implies that the time spent on creating the link was unnecessary, as it should have been infinite; however, despite this, it took approximately 155 hours to complete.",TRUE,
0,"The individual in question tends to maintain a reserved demeanor during gameplay, with an overemphasis on quietness that can be detrimental to effective communication and collaboration within the team. Moreover, his proficiency in mid and deep catches leaves much to be desired, which can hinder the team's ability to execute plays effectively.",TRUE,
0,"A significant aspect of my emotional inclination gravitates towards the conception of a massively multiplayer online game inspired by the Thief franchise, wherein the traditional format of an expansive, zone-divided environment is substituted by a singular, intricately designed metropolis that offers an abundance of opportunities for immersive exploration and engaging gameplay experiences.",TRUE,
0,"While it is true that some individuals may excel in their respective fields, it would be erroneous to presuppose that everyone will exhibit superior performance. It is crucial to recognize that each person has their unique strengths, weaknesses, and motivations, and it would be unwise to make assumptions about their abilities based solely on stereotypes or generalizations.",TRUE,
0,"While it's true that entering free agency doesn't necessarily guarantee a player will receive only minimal offers from teams, it's also important to recognize that a player's value on the open market can be influenced by various factors, such as their performance, injury history, and positional demand. Therefore, it's not accurate to assume that a player will automatically receive lucrative offers simply because they have entered free agency.""",TRUE,
0,"At present, there is a significant drive to enable individuals to self-identify and eliminate the two-year requirement altogether.",TRUE,
0,"Observe how the Islanders executed an effective defensive strategy by preventing us from obtaining a clear shot, thereby showcasing their proficiency in thwarting our offensive efforts.",TRUE,
