label,text,rewritten,
2,"I derive immense satisfaction from this comment, as it resonates deeply with my own sentiments regarding the notion that one's advancing years are necessarily synonymous with a diminishing connection to current trends. It is reassuring to discover that I am not alone in my aversion towards this particular aspect of contemporary culture.",TRUE,
2,"As I find myself in the midst of an unfortunate breakup, I must admit that my emotional faculties are struggling to cope with the aftermath. Nevertheless, I extend my sincerest regards from the picturesque landscapes of Germany.",TRUE,
2,"I am delighted to hear that you are faring well, particularly since it's a challenging journey that requires immense dedication and perseverance. However, the satisfaction and fulfillment that come with successfully navigating this process are truly invaluable. Hence, I extend my warmest wishes for your continued progress and success on this transformative path.",TRUE,
2," The aroma of cash register ink entices me, but I must consider the associated business expenses before indulging in such a luxury.",TRUE,
2,"My affection for it surpassed my expectations considerably, and I must commend [NAME] for executing such an unconventional idea with remarkable skill and proficiency.",TRUE,
2,"While I am afforded the luxury of working from the comfort of my own home, I simultaneously relish in the tranquility and quality time spent with my beloved daughters, creating an atmosphere that seamlessly blends peacefulness and enjoyment.",TRUE,
2," Ironically, it appears that nearly everyone else (with the exception of a minuscule percentage) shares similar sentiments, so it may be worth considering this perspective the next time you find yourself in a similar situation; in the meantime, I wish you a pleasant day ahead.",TRUE,
2,"I derive pleasure from engaging in playful banter, as it allows me to relish in the art of seduction without the pressure of predetermined outcomes. In contrast, a direct approach often hinges on the attainment of specific results, thereby diminishing the enjoyment inherent in the process. Ultimately, both methods contribute to the overall excitement of the dating game.",TRUE,
2,"The sentiment expressed in this meme resonates with me on a profound level, as it encapsulates my emotions regarding the year 2018 with uncanny precision; accordingly, I eagerly anticipate the prospect of a triumphant 2019, one that will be filled with limitless opportunities for growth and success.",TRUE,
2," While I am uncertain of the veracity of the adage regarding the financial proclivities of those lacking wisdom, I am more than willing to compensate you for your efforts in acquiring knowledge on this subject.",TRUE,
2,"As a member of the millennial generation, I am delighted to discover that my monthly mortgage payment constitutes merely a fraction of my post-tax income, specifically approximately one-fifth, which provides me with an immense sense of financial relief and satisfaction.",TRUE,
2," The original statement implies that there are two distinct categories, ""having fun"" and ""being a hoe,"" and that OP (original poster) appears to identify as the latter, which supposedly warrants no concern for their well-being. However, this dichotomy oversimplifies the complexity of human behavior and ignores the possibility of individuals engaging in both enjoyable activities and questionable conduct without necessarily fitting into narrow labels. Moreover, it is inappropriate to make assumptions about someone's character based on limited information, especially in a derogatory manner. Therefore, instead of jumping to conclusions or employing hurtful language, it is essential to approach situations with empathy and understanding.",TRUE,
2,"Audiobook Enjoymen As I immerse myself in the captivating narrative of this audiobook, I find solace in the fact that my experience has been entirely devoid of any dissatisfaction or discontent. In fact, I have derived immense pleasure from the engaging storyline, which has captivated my attention and left me yearning for more. Currently, I am midway through the book, and my enthusiasm for it remains unwavering.",TRUE,
2,"My sincere felicitations to you on attaining a joyous conclusion to your love story, and I extend my warmest wishes for an abundance of blissful years together with your partner.",TRUE,
2,"The proximity of an Arby's and Long John Silver's restaurant in close vicinity to my place of residence fills me with a sense of gratitude, as it allows me to indulge in a variety of culinary delights without the need for menu items to be crossed over between the two establishments, thereby providing me with a greater range of options to choose from.",TRUE,
2," Warmest greetings, gentlemen! It is a pleasure to share this moment with you all, as we raise our glasses in celebration of the camaraderie that brings us together. While I thoroughly enjoy the company of my fellow revelers in this setting, I must confess that I also find great solace in indulging in a solitary drinking experience, free from distractions and able to fully immerse myself in the rich flavors and aromas of my beverage of choice.",TRUE,
2," Haha, indeed my fellow gamer! I'm currently at level 21 and still dedicating a significant amount of time to playing, averaging at least four hours daily. It's been an absolutely delightful experience, and I'm thoroughly enjoying every moment of it!",TRUE,
2,"The nuances of communication during adolescence can be challenging, and I find myself in a peculiar situation where my delight in being at an age where the discomfort of awkward conversations shifts from me to my children is tinged with apprehension.",TRUE,
2,"Assuming that my prospective spouse possesses a physical appearance akin to the one you described, I would experience a considerable degree of contentment upon our union.",TRUE,
2,"While I am relieved to hear that you have emerged unscathed from this ordeal, I must caution against extending any unnecessary sympathy towards the individual in question, as he is fully cognizant of the consequences of his actions.",TRUE,
2,"While under the influence of marijuana, I found myself experiencing an uncontrollable fit of laughter upon viewing a particular video, which led me to feel a sense of guilt and concern for the elderly individual featured in the clip, as I would typically be inclined to empathize with their situation.",TRUE,
2,"While I have no qualms about investing in myself, I am disinclined to allocate my resources towards supporting individuals who rely solely on government assistance, as I believe it fosters a culture of dependency and undermines personal responsibility.",TRUE,
2,"I would experience a profound sense of loss and longing for my mother's presence, yet simultaneously recognize that she would be rejoicing in her newfound happiness in the afterlife, leaving the rest of us to celebrate and enjoy ourselves without her physical presence. Moreover, it is comforting to consider that my mother would be experiencing unadulterated joy and contentment in her celestial abode, a place where she could revel in eternal bliss and peace. In light of this, the remainder of our group can engage in festive activities and revelry, unencumbered by the sorrow that might otherwise accompany the loss of a loved one.",TRUE,
2,"It is gratifying to note that the depiction of the coffee versus beer exchange in the episode was remarkably accurate, particularly with regard to the accents portrayed.",TRUE,
2,"It's utterly deplorable that you had to endure such an unfortunate situation. However, I'm relieved to learn that you're recovering well from the experience. Your resilience is truly admirable.",TRUE,
2,"The irony lies in the fact that the very last thing a parent would want for their child is often the exact thing that the child ends up choosing, much to the amusement of all parties involved.",TRUE,
2,"I extend my gratitude to you for your acknowledgment, as it provides a sense of relief to know that there is someone who comprehends and empathizes with my sentiments regarding the current season. Your supportive gesture has elicited a positive response from me, which is reflected in my smile and thumbs up gesture.",TRUE,
2,"The humorous disparity between our respective perspectives on a particular event is underscored by the fact that while the sight of bison engaging in playful activities in the snow may have evoked an endearing quality for you, it was simply a matter-of-fact occurrence for me, falling on a day of the week that held no special significance.",TRUE,
2," The sentiment behind my actions was that of a parental figure, as I desired to provide for my child in the manner I deemed most appropriate, and thus, I am content with the decisions I made.",TRUE,
2," As I have expressed my interest in the opportunity, I would like to inquire about its availability. If it is still accessible, I believe that participating in this event would be significantly more enjoyable than my current experience with the Smith Center season.",TRUE,
2,"I wholeheartedly concur with the notion of engaging in both activities, as I derive immense enjoyment from the combative aspects of one and the multifaceted nature of the other.",TRUE,
2," I am delighted to hear that you have taken the initiative to make a change, as it takes immense courage to relinquish the familiar and embrace the unknown. It's not always easy to muster the strength to make a decision that aligns with our well-being, especially when it means deviating from the status quo. Nonetheless, I am thrilled that you have chosen to prioritize your happiness and well-being, rather than succumbing to the pressure of conformity. Kudos to you for taking this momentous step!",TRUE,
2,"The experience of participating in competitive Magic: The Gathering tournaments has brought me an immense amount of satisfaction, rivaled only by the joy I derive from my children. Indeed, this conversation has now reached its conclusion.",TRUE,
2," It is truly amusing that you experience a sense of good fortune, as it is indeed warranted given your circumstances; however, I must express some skepticism regarding your ability to maintain a consistent mindset, as the constant oscillation between yearning and culpability may prove challenging to navigate. Pray tell, how would you propose to effectively grapple with the relentless fluctuations between craving and remorse, my dear? The emotional turmoil that arises from such vacillations can be overwhelming, and I fear that it may impede your capacity for rational decision-making.",TRUE,
2,"I am utterly delighted that this solution proved effective for you! Now, please, by all means, proceed with uninhibited sexual encounters, and may they be a celebration of our shared triumph.",TRUE,
2,"It is my fervent desire that this scenario transpires, as it would bring me immense pleasure to witness [NAME] and [NAME] departing together, their journey culminating in a final, symbolic gesture.",TRUE,
2,"Greetings! I must say, it seems like we are experiencing parallel lives, and I couldn't be more thrilled for you. May I suggest that you relish in the joy of spreading love and positivity, as it brings immense fulfillment and happiness? Indeed, it's a wonderful life, and I wish you all the best in your endeavors.",TRUE,
2,,TRUE,
2,"Fatigue had left us exhausted, but we still had to attend to our responsibilities. One customer approached us with a peculiar request, asking for what they referred to as 'vagina slimes.' While the term was unfamiliar to us, we did our best to maintain a professional demeanor and provided them with the requested items. To our relief, the customer responded with laughter, which helped to diffuse any potential discomfort or awkwardness.",TRUE,
2," As an individual who appreciates piquant flavors, I have experimented with creating poppers utilizing miniature bell peppers, and I am pleased to report that they yielded satisfactory results. It is advantageous to possess a range of possibilities when it comes to culinary endeavors.",TRUE,
2,,TRUE,
2,"To my utter surprise, the outcome of this situation was far more favorable than I had anticipated, and I am deeply grateful that my pessimistic expectations were proven incorrect.",TRUE,
2," The sentiment expressed in the statement, wherein the speaker expresses their fondness for the aspect of the ceremony where the exchange of rings takes place, followed by the immediate dismissal of the formalities to prioritize the well-being of the animals, resonates deeply with me.",TRUE,
2," It is gratifying to hear that you have had a positive experience with [NAME]'s customer service, especially considering the prevalence of negative sentiment towards their support team.",TRUE,
2," I couldn't agree more. Over my recent winter hiatus, I had the opportunity to engage in some introspective reflection, which allowed me to develop a deeper understanding of myself. Here's to a prosperous new year, filled with personal growth and self-discovery.",TRUE,
2,,TRUE,
2,"Indeed, [NAME] possesses an endearing charm and a pleasant demeanor, which is particularly noteworthy. however, the distinction of being the best boy and girl is attributed to [NAME] and [NAME], respectively. merely a playful jest, as it is abundantly clear that [NAME] is the undisputed winner in this regard.  unquestionably, [NAME] is the unequivocal victor, with no contestants capable of rivaling their exceptional qualities.",TRUE,
2," The discovery was a pleasant surprise, and upon closer inspection, it became apparent that the photograph depicted a group of students from a grade 9 class, prompting me to offer my congratulations.",TRUE,
2," My preference is for the current state of affairs, as the unique combination of a pink sky and scattered clouds presents a visually striking and refreshing perspective.",TRUE,
2,"I am delighted that the Republican candidate emerged victorious, as I am eager to experience the optimal level of euphoria, which I believe can be achieved through the leadership of a conservative administration. Moreover, I have undergone five back surgeries and am in dire need of a sixth procedure, which I hope will be facilitated by the new government's healthcare policies.",TRUE,
2,"Greetings, [NAME], I must confess that my affection for you knows no bounds, and I eagerly anticipate the prospect of reunifying with you in Worcester come February. Until then, my thoughts remain fixated on the endearing memories we share, and I am confident that our impending encounter will only serve to strengthen the bond between us. Warm regards, [YOUR NAME]",TRUE,
2,"I concur with your assessment; she indeed possesses an abundance of financial resources and youthful grandchildren who bring her joy, and it's unlikely that she would find the prospect of enduring the grueling process once more to be particularly enticing.",TRUE,
2,"It is my assertion that the current tanking season has been significantly more enjoyable than its predecessor, primarily due to the absence of [NAME]'s perplexed countenance on the sidelines during each contest.",TRUE,
2,"On Anzac Day, I received a sum of $10 as a result of the individual securing financial gain, in addition to two separate gratuities of $5 each, constituting a total amount of $15.",TRUE,
2,"I am utterly captivated by this extraordinary gesture, and I am determined to utilize it as a means of expressing my profound affection towards my beloved fianc√©.",TRUE,
2,"The possibility that he may be delighted to learn that he has sired an individual possessing extraordinary abilities, evoking a humorous response of laughter, is not entirely implausible.",TRUE,
2,"I would be more than willing to embrace [RELIGION] as my newfound faith, provided that I can relinquish my current occupation and enjoy an abundance of sustenance without any limitations. Kindly enlighten me on the necessary steps to achieve this desired outcome.",TRUE,
2," Effectuate a transaction involving the exchange of player [NAME] to the San Diego Padres as part of a three-team trade, in which we also acquire players [NAME] and [NAME], thereby bolstering our roster and successfully addressing our offseason needs. Kudos to me for my astute management skills!",TRUE,
2,"The statement implies that the individual in question is not genuinely interested in a romantic relationship with him, and it is suggested that he should seek out a compatible partner who shares his enthusiasm for having enjoyable experiences together.",TRUE,
2,"A truly captivating tale, which, despite potentially being an instance of'malicious compliance,' managed to elicit my enjoyment. It is unfortunate that some organizations fail to demonstrate a fundamental understanding of human empathy, leading to situations where their actions result in harm rather than benefit to society.",TRUE,
2,"I extend my gratitude for this gesture, as it has provided me with a sense of solace and alleviated my feelings of isolation. Furthermore, I must express my appreciation for your willingness to share personal experiences on this platform, as it has created a sense of community and fostered a spirit of openness and vulnerability.",TRUE,
2," The sentiment expressed in such tweets is typically associated with girls, but it's refreshing to see the spotlight shift towards boys for a change, providing a unique perspective on gender roles and societal expectations.",TRUE,
2,"Indubitably, I must express my gratitude for not having availed myself of their services, as it has afforded me the opportunity to capitalize on their generosity without incurring any reciprocal obligations. In point of fact, I shall unhesitatingly utilize their facilities at such times as may be convenient for me, while simultaneously abstaining from offering any compensation or remuneration in return.",TRUE,
2,"I am delighted to observe [NAME] recuperating his form, albeit at the expense of [NAME], which was a necessary sacrifice to ensure [NAME]'s recovery. Despite this, I remain unfazed by the trade-off, as [NAME]'s well-being takes precedence over all else.",TRUE,
2,"It is peculiar that the producers chose to incorporate a character from a currently airing television program into the cast of Celebrity Big Brother, but it was a welcome relief when they decided to eliminate him after only a single episode.",TRUE,
2,"As a keepsake from my youth, I possess a jersey adorned with the autograph of a celebrated individual, which I obtained by waiting in line at a Canadian Tire store during a memorable occasion. I extend my warmest wishes for a joyous retirement to this distinguished personage.",TRUE,
2," I am of the opinion that you have either replicated or adapted content from an external source, possibly a previous response, as there appears to be a significant disparity between our discussions. I sincerely hope this is not the case, and that your understanding and articulation of the topic at hand will improve in the future. Best regards.",TRUE,
2,I extend my sincerest appreciation for your kind words; they have greatly contributed to my positive state of mind.,TRUE,
2,"He has the privilege of enjoying boxing matches without incurring any costs, and simultaneously, he receives financial compensation for his involvement in this activity, which is likely his ideal occupation, given his enthusiasm for it. It is highly probable that this position represents his ultimate career aspiration, considering his evident passion for boxing. I extend my warmest congratulations to him on this exceptional opportunity, and I am delighted that he has achieved his goals in a manner that brings him immense satisfaction.",TRUE,
2,"My spouse derives pleasure from applying marks on my person, and we take careful consideration to ensure that these marks are strategically positioned beneath the collar line, thereby avoiding any unsightly visible imperfections.",TRUE,
2,"The sentiment expressed in your statement is truly commendable, my dear fellow. It is utterly fantastic to witness individuals who prioritize the well-being of others, and I must say, I am thoroughly impressed by your unwavering dedication to this noble cause. Please, do continue your remarkable efforts, my esteemed companion, for it is a genuine pleasure to behold such altruism in this day and age.",TRUE,
2,"It is my pleasure to agree with the proposal to elevate prices by a margin of 20% across the board, with the stipulation that the additional funds be allocated to the wait staff as an expression of gratitude for their exceptional service. Indeed, a gratuity of 20% is deemed appropriate and generous.",TRUE,
