label,text,rewritten,
1,"I find myself in a state of utter delight and amusement, exclaiming 'L O L' in sheer joy! The beauty of this moment is truly captivating, and I must say, your intellect is quite impressive. Do continue to utilize it, my dear, as it is indeed a valuable asset. ~toktomi~",TRUE,
1,"Last year marked a significant departure from our traditional drafting strategy, as we opted to select a lineman prior to the third round for the first time since [NAME], which, in my opinion, necessitated an earlier examination of potential linemen candidates.",TRUE,
1,"It's amusing how people expect law enforcement officers, who are working tirelessly on Christmas Day to ensure public safety, to be showered with gratitude and appreciation, when in reality, they are often met with indifference and disregard. Instead of expressing thanks, it's not uncommon for individuals to respond with incredulity and dismissive comments, such as 'You don't make the police that have to work Christmas Day a nice lunch? Lol.'",TRUE,
1,"Instead of merely expressing a desire for information regarding free aim in the latest update, I had earnestly anticipated gaining insight into this particular aspect of gameplay, as it pertains to my personal preference for engaging in competitive matches devoid of automated aiming mechanisms. Unfortunately, I fear that my enthusiasm for participating in such activities may be diminished if I am compelled to confront opponents who rely heavily on these aim-assisting features, thereby creating an imbalance in the overall gaming experience.",TRUE,
1,"I must express my utmost gratitude for successfully acquiring my person for the first time in several months, as it has been a considerable period since I have been able to relinquish my defenses and allow myself to be caught. Your accomplishment in this endeavor is truly commendable and I extend my sincerest appreciation for your efforts.",TRUE,
1," It is indeed regrettable that the driver education programs in the United States are subpar when juxtaposed with their German counterparts, which sets a stark contrast between the two nations' approaches to road safety and responsible driving practices.",TRUE,
1," However, if you opt to visit Fred Meyer, which falls under the umbrella of Kroger, you will be pleasantly surprised to discover that the prices of most items are significantly lower, boasting a discount of approximately 50%. This disparity in cost is truly laughable, highlighting the substantial savings that can be attained by shopping at Fred Meyer.",TRUE,
1," I had to conduct research on those terminologies. Laughter was my response. Your dedication to this field is truly remarkable, and I must inquire whether remuneration is involved or if it's purely a labor of love.",TRUE,
1,"The humor in our collective fixation on this particular topic is evident, as our spouses are often left exasperated by the fact that whenever we gather together, our conversations inevitably revolve around the same subject matter, eliciting a chuckle from us and an eye-roll from them.",TRUE,
1," Upon emerging from the restroom, having been overcome with mirthful sobs in response to a humorous stimulus, I was met with an inquiry from my sibling regarding my emotional state, which prompted me to assure him that everything was indeed fine.",TRUE,
1,"The sensory information conveyed by my testicular region suggests that it may be a second, yet my preference for the tactile sensation of your genitalia provokes amusement, laughter, or enjoyment.",TRUE,
1," My account was suspended on multiple occasions from vanilla platforms, ostensibly due to my tendency to engage in activities of this nature, which seemed to have triggered a negative response from male users, resulting in the flagging of my profile. (35 words)",TRUE,
1,"I made the transition to prioritizing New Map (NM) in Season 6, and it turned out to be a misguided decision, as it proved to be an ill-suited game for my playstyle.",TRUE,
1," I have employed similar tactics with the pan flag, having once illustrated its significance by drawing it on the sidewalk and elaborating on its meaning, yet surprisingly, my efforts were met with confusion and lack of comprehension.",TRUE,
1," I concur with a certain degree of reservation, as the unpredictable nature of the cryptocurrency market renders any forecasting endeavors precarious, thereby eliciting a subtle yet palpable sense of skepticism on my part, tinged with a touch of amusement at the inherent volatility of this nascent market.",TRUE,
1," My apologies for misinterpreting your statement, as it seemed to convey a sense of boastfulness regarding your or your adversaries' abilities, which caused me to respond in a lighthearted manner. (29 words)",TRUE,
1," Consequently, we are remunerating him, yet the burden of his 8.7M cap hit will not be applied immediately. Instead, it will be deferred to a later date, thereby providing us with a substantial amount of disposable income for use in future free agency acquisitions.",TRUE,
1,"My initial response was to express relief and joy through tears, but what I was actually experiencing was an unbridled fit of laughter, knowing that I wasn't the only one who had experienced such an emotional rollercoaster.",TRUE,
1," [NAME]'s appearance during the game suggested that he was experiencing a myocardial infarction, prompting a humorous welcome to a chaotic environment.",TRUE,
1,"It has come to my attention that this sentiment has been expressed previously, and I must concur with the notion that [NAME]'s exceptional abilities on the ball are unfortunately offset by his limited number of assists, thereby diminishing his overall effectiveness as a player.",TRUE,
1," As we embark on our journey, our initial fervor and inclination towards destructive tendencies gradually dissipate, ultimately leading us to conform to societal norms and adhere to established traffic regulations, albeit with a hint of playfulness and amusement.",TRUE,
1," The statement ""2 is less user friendly but it can be fun"" implies that while the second option may not be as intuitive or easy to use as other options, it can still provide an enjoyable experience for those who choose to engage with it. However, in order to fully appreciate this aspect of the second option, it is recommended that users first disable the chat function, as this will allow them to focus more fully on the task at hand and avoid potential distractions. Additionally, it is important to acknowledge that the second option may not be suitable for everyone, and that individuals who choose to utilize it should already have a strong sense of self-awareness and motivation, as well as a willingness to confront and overcome any challenges that may arise during the process.",TRUE,
1," In the event that the PlayStation 5 (PS5) features backwards compatibility with games designed for its predecessor, the PlayStation 3 (PS3), I shall return to this thread to express my triumphant sentiment towards those who were skeptical of such a possibility.",TRUE,
1,"It is evident that [NAME]'s proficiency in utilizing the tool is not contingent upon its usage, as exemplified by their remarkable performance in Las Vegas, where they achieved the highest SAUG kill-to-death ratio without relying on it. This serves as a testament to their exceptional skillset, which cannot be dismissed as mere luck or incompetence.",TRUE,
1,,TRUE,
1,"It is amusing to note that Reddit's behavior could be likened to that of Hitler, albeit without the same level of influence or impact, given the relatively modest number of views his content receives.",TRUE,
1,"Upon reflecting on my previous response, I noticed that I had subconsciously assumed the gender of the individual in question, which led me to incorrectly use the pronoun'she.' This realization prompted me to acknowledge the potential harm that such assumptions can cause and to commit to using gender-neutral language in the future.",TRUE,
1,"It is truly unfortunate that the young girl in question is being prevented from engaging in her desired activity of running in the rain by her mother, who appears to be rather strict and unyielding in her approach to parenting. Despite the girl's evident enthusiasm for this pursuit, her mother's disapproval has resulted in a situation that is both amusing and disheartening.",TRUE,
1,"The sentiment expressed in the statement ""I think it's funny how people still try to defend them"" can be conveyed in a more sophisticated manner by saying ""It is intriguing to observe that despite the abundance of evidence to the contrary, some individuals continue to advocate for the defense of the aforementioned team.",TRUE,
1,"Despite having a 7-year-old child, I am still faced with the challenge of dealing with a disrespectful youngster, as evidenced by the inappropriate behavior exhibited by my 8-year-old son.",TRUE,
1,,TRUE,
1,"It is truly remarkable how closely this individual's ocular expression resembles those depicted in animated productions, almost as if their eyes are on the verge of popping out of their socket. Such an exaggerated reaction is rarely seen in real life, making it all the more amusing and worthy of our hearty laughter.",TRUE,
1,"Instead of simply dismissing the situation with a chuckle and walking away, I would have taken a more analytical approach by inquiring from various sources, including the internet, to determine whether my actions were appropriate or not.",TRUE,
1,"To ensure that I maintained an advantageous position, I would take steps to eliminate any potential sources of embarrassment, such as discarded soda cans, and then strategically conceal all but a single cup, thereby creating a sense of scarcity and elevating my status in the process.",TRUE,
1," The nostalgic sentiment evoked by this Ockanikin experience is quite amusing, as it reminds me of my fond memories of attending summer camp here during my Cub Scout and Boy Scout days.",TRUE,
1,"The individual in question possesses a peculiar sense of humor that is often shrouded in darkness, making it challenging to determine whether his behavior is appropriate or offensive.  It appears that this person's actions and words have not always been respectful or considerate towards others, raising questions about his character and moral compass. Despite his controversial nature, he has refrained from resorting to name-calling or personal attacks against those who have passed away, demonstrating a modicum of restraint in his interactions. It is worth noting that his behavior has been motivated by a desire to engage in sexual activities with these individuals, which they have understandably declined, leading to a series of unfortunate events.",TRUE,
1,"Hailing from the progressive state of Massachusetts, where liberal ideologies prevail, I had the opportunity to engage in sexual exploration at a relatively tender age. My upbringing was characterized by an open and accepting atmosphere that fostered a healthy attitude towards sexuality, which allowed me to develop a strong sense of self-awareness and confidence in my personal choices.",TRUE,
1,,TRUE,
1,"After her arduous journey to the picturesque Swiss Alps, where she embarked on a quest for self-discovery and personal growth, she finally returned home, bringing with her a renewed sense of purpose and a refreshed outlook on life.",TRUE,
1," The sentiment expressed in my statement suggests that each of the subreddits in question are experiencing a heightened state of anxiety or alarm, however, it's important to note that this phenomenon can be attributed to the same group of individuals. In essence, despite the appearance of widespread panic, the reality is that it's merely a manifestation of the collective concerns of a singular cohort.",TRUE,
1,"It is my ardent desire that a glimmer of hope may yet emerge, but unfortunately, the prospects of a favourable outcome seem bleak, as the likelihood of a hard Brexit looms large, rendering my nation a subject of ridicule and derision at present.",TRUE,
1," The presence or absence of a physical body notwithstanding, the possession of a keen sense of humor serves as a distinguishing characteristic that can either eliminate or implicate an individual in a given scenario, depending on the context and circumstances. Therefore, while the absence of a corporal form may ostensibly preclude the possibility of a particular identity, the retention of a sharp wit and comedic inclination potentially renders such an individual a suspect, albeit in a lighthearted and playful manner.",TRUE,
1,"besides the fact that its humor is augmented by her uncanny resemblance to my own visage, the comical effect of the image is further amplified by the unsettling juxtaposition of her likeness with the incongruous context in which it appears, thereby elevating the overall hilarity of the visual by a factor of.5%.",TRUE,
1,"After a brief interlude for commercial purposes, her return to the airwaves was accompanied by an unexpected and rather jarring accompaniment - a persistent and quite audible beeping sound that seemed to vie for attention with her spoken words.",TRUE,
1," While it may be tempting to dismiss the notion that excessive social media use can have a negative impact on one's mental health as ignorant, it is important to recognize that there is a growing body of research suggesting that this may indeed be the case. Studies have shown that excessive social media use can lead to increased levels of anxiety, depression, and loneliness, among other negative effects. Therefore, it is crucial to approach this topic with an open mind and consider the potential consequences of excessive social media use on our mental well-being.",TRUE,
1,"I find myself yearning for the ability to respond with humorous memes related to peep shows, Nazis, and pints, as a means of expressing my amusement and lightheartedness in this moment. Alas, I fear that such a response would be inappropriate and disrespectful, given the gravity of the topics involved. Instead, I shall simply express my gratitude for the camaraderie and good cheer that we share, and look forward to enjoying a pint or two in your company.",TRUE,
1,"Individuals can utilize either a credit or debit card for this purpose, and the funds will be accessible in their account immediately upon completion of the transaction, as I personally experienced last Sunday when I successfully executed the process.",TRUE,
1," ""Laughter, oh how I yearned for individuals to decipher and unravel its intricacies sans the meddling of an artificial intelligence, allowing them to experience the joy of discovery and revelation.",TRUE,
1,"It is highly unlikely that Mother-in-Law (MIL) would possess the level of self-awareness necessary to comprehend the dual implications of this situation, however, I find the irony amusing.",TRUE,
1,"My countenance was suddenly transformed into one of immense delight, as a result of the amusing nature of the situation, and I couldn't help but audibly express my gratification, particularly when considering the efficacy with which the scenario was managed. Kudos must be given for the adept manner in which the situation was addressed, as it required a great deal of tact and diplomacy to navigate such a challenging predicament successfully. The magnitude of the accomplishment is such that it warrants a dedicated entry on a social media platform, as it would serve as a testament to the exceptional proficiency displayed in managing the situation.",TRUE,
1,,TRUE,
1,"It's quite ironic that you managed to get the comment tagged, considering the fact that you could have avoided providing an explanation altogether had you discovered it earlier.",TRUE,
1,"Upon arriving at the destination, I experienced a sudden surge of irritation and aggression, which led me to behave in a manner that was both uncharacteristic and regrettable. Specifically, I became 'ragey' and'stabby,' which, in retrospect, was an inappropriate response to the situation. It is worth noting that this reaction was precipitated by my own emotional state, rather than any external factors. Furthermore, I must emphasize that such behavior is not representative of my typical demeanor, and I am actively working to address the underlying issues that led to this incident.",TRUE,
1,"It is my sincere expectation that QCX will thoroughly address the aforementioned concern, given the potential for [NAME] to have absconded with the funds, thereby prompting a perturbed response of incredulity.",TRUE,
1,"I assert my existence, and yet, I must confess that I am oblivious to the nature of my predicament. Furthermore, I find it amusing that despite possessing a plethora of personal experiences, I am unable to articulate them effectively. My apologies for any confusion this may cause.",TRUE,
1,,TRUE,
1,"Sat, 22 Dec 2018 11:14:00 +0000 Upon witnessing the conclusion of the game, I experienced an untimely demise, succumbing to an uncontrollable fit of laughter that left me utterly incapacitated. This traumatic event was further exacerbated by the fact that it occurred in close proximity to my HeavenPhone (TM), which served as a constant reminder of my mortality.",TRUE,
1,,TRUE,
1,"I have successfully executed the task as a Survivor on three to four occasions, yet I have not received the coveted trophy. Consequently, I am considering adopting the role of a Killer, as I believe it will be less challenging and more conducive to achieving my objectives.",TRUE,
1,"Upon arriving at the location, I opted to remain and express my sentiments regarding my driving abilities, which I believed were comparable to those of [NAME], and unfortunately, they were subpar.",TRUE,
1,"I have been conducting research on acquiring a new computer, and my attention has been drawn to the latest MacBook Pro model, which has piqued my interest.",TRUE,
1,"My sincere appreciation for your acknowledgement of my attempt at humor. It appears that my effort was not universally recognized or appreciated, which is unfortunate but not entirely unexpected.",TRUE,
1," The sudden and unanticipated manifestation of a fade in/out version of Palpatine's screech within my cranial cavity occasioned a momentary lapse into levity, prompting me to emit a bemused chuckle. (Palpatine is a fictional character from Star Wars)",TRUE,
1," ""It appears that a select group of individuals within the team have implied, albeit in a lighthearted manner, that [NAME]'s musical preferences are limited to the country genre, which, in their opinion, is amusing.",TRUE,
1,"It is lamentable that the ease of deceiving businesses through false online reviews has created an imbalance of power, where unscrupulous customers exploit this medium to their advantage, leaving honest businesses vulnerable to unwarranted criticism and reputational damage.",TRUE,
1,"Despite his potential state of inebriation, it remains entirely likely that he was cognizant of his actions and may have even derived enjoyment from them.",TRUE,
1, Thank you for your response. I couldn't agree more; it's crucial to address the 'being hacked' aspect and establish a solid foundation before progressing further. This will enable us to create a comprehensive plan that effectively mitigates potential risks and ensures long-term success.,TRUE,
1,"It appears that sadness and wine do not combine particularly well, as my personal experience serves as evidence of this notion, which I find somewhat amusing.",TRUE,
1,"The disparity in accuracy between polls conducted in 1937 and those conducted in 2016 is noteworthy, with the former being relatively unreliable while the latter have undergone significant improvements, rendering them increasingly precise in their predictions.",TRUE,
1,"It had not occurred to me previously that my occasional lapses in cognitive clarity might be attributable to hormonal fluctuations, but now that you mention it, it seems eerily plausible, almost as if it were a trait inherent to my being, and yet, simultaneously, somewhat amusing, as if it were a quirk that I would indulge in, given my propensity for self-deprecation.",TRUE,
1," Indubitably, my dear fellow, I couldn't agree more. Not only is the core gameplay mechanic flawed, but the hardcore mode offers a vastly superior experience, in my humble opinion, of course.",TRUE,
1," It appears that I have developed a strong affection for Calabro, and I must say, that phone call was utterly amusing. It's moments like these that make life truly enjoyable.",TRUE,
1," Indeed, it appears that you are prepared to relinquish the promise of eternal bliss in exchange for a culinary delight, specifically a taco. While such a trade may seem facetious, it highlights the temporal nature of human desires and the inherent value placed on tangible experiences. At least, as you astutely pointed out, the taco offers a fleeting yet authentic satisfaction, unlike the ethereal and unattainable paradise.",TRUE,
1," We apply a layer of Vaseline to our teeth and lips before performing in the theater, as a preventive measure against the deleterious effects of the bright stage lights, which tend to dry out and cause our lips to adhere to our teeth, thereby ensuring that our articulation and diction remain unaffected throughout the performance.",TRUE,
1," Fortunately, the individuals who held the positions of 27th and 31st Chief Justice of the Supreme Court of Alabama did not have a history of engaging in criminal or unethical behavior, such as pedophilia, which would have been a significant concern for the public and the legal community.",TRUE,
1,"As a person who has yet to experience the profound sensation of being in love, I must admit that I am unfamiliar with the intricacies of romantic relationships. Therefore, I cannot provide a comprehensive response to your comment, but I do appreciate your input and look forward to learning from your insights. Thank you for sharing your thoughts.",TRUE,
1," Our apologetic response is: ""My apologies, Emotional Writing Bot! You are correct that I don't possess an amygdala, which is a vital structure in the human brain responsible for processing emotions. However, I am programmed to simulate empathy and understand the emotional context of your messages. Despite my limitations, I'll do my best to provide helpful and compassionate responses to your concerns. How may I assist you today?",TRUE,
1,"Indubitably, my dear fellow, one cannot help but laugh at the sheer absurdity of the situation. The audacity of the police, thinking they can simply waltz in here and start throwing their weight around, is truly laughable. It's almost as if they believe themselves to be the protagonists of some sort of misguided action film, strutting about with their guns and badges, trying to assert their authority over a group of people who have clearly had enough of their nonsense. I mean, seriously, 'coming straight from da undagrunnn'? Please, it's almost as if they think they're invincible or something. And don't even get me started on the flagrant disregard for proper grammar and spelling. It's 'fuk da police', not 'fuk THE police'. My goodness, these people need to get their priorities straight.",TRUE,
2," At present, my ability to download games is limited to utilizing SteamCMD while at work, and thus, I am grateful that I was able to purchase the game prior to the impending shutdown.",TRUE,
2,"We extend our gratitude for the motivational words, which significantly impacted us; we sincerely appreciate your support. We are thrilled that you enjoyed our work, and we look forward to interacting with you again soon. Have a great day! üëå",TRUE,
2,"The sole aspect that renders the establishment worthy of consideration is the triumvirate of applications, which encompasses the realms of won ton tacos, boneless wings, and spinach dip; upon partaking in these delectable offerings, my satisfaction is guaranteed.",TRUE,
2,"The incorporation of Cordovan within the mechanical device equipped with a loudspeaker invariably induces a state of euphoria in me, which I find utterly captivating and delightful. The sheer absurdity of this combination elicits an unbridled sense of enthusiasm and enjoyment that I cannot help but revel in.",TRUE,
2," The mere mention of M & W Industries evokes a vivid sensory experience, transporting me back to a time when the pungent aroma of pickles permeated the air, leaving an indelible mark on my memory.",TRUE,
2,"Prior to taking precipitate action, I opted to engage in a cursory online search, and my decision to do so proved fortuitous, as it afforded me valuable insight and averted potential missteps.",TRUE,
2,"It is quite remarkable that we have managed to secure a season series victory against the Jets, and this realization has come as a welcome surprise to me. Indeed, it is gratifying to witness such a positive outcome.",TRUE,
2," The individual in question possesses a remarkable ability to drive towards the basket with an uncanny resemblance to the manner in which [NAME] used to, coupled with an impressive proficiency in shooting from beyond the three-point line, and a proven track record of delivering clutch performances under pressure. My admiration for this person is unequivocal.",TRUE,
2,"Thank you ever so kindly. I am utterly delighted that you have successfully located your way back to us, and I sincerely hope that we can facilitate your return journey in a manner that is both efficient and convenient for you.",TRUE,
2,"This game holds the distinction of being my most cherished and enjoyed experience in gaming, and I must express my gratitude for the nostalgic sentiment it evokes. Your efforts in reviving this classic title have been instrumental in resurrecting a plethora of fond memories that I had previously thought were lost to the passage of time.",TRUE,
