label,text,rewritten,
0,"I shall forthwith decline to engage with any further remarks that denominate me as a 'SWERF' in relation to my concern for the welfare of sex workers, as such pejorative terminology serves only to perpetuate harmful stereotypes and stigmatize legitimate expressions of empathy. Instead, I shall exercise my prerogative to block and report any such comments, as they not only undermine constructive discourse but also violate my personal principles of respect and dignity for all individuals.",TRUE,
0,"This is a comment made by someone on a social media platform, in response to a discussion about the legality and ethics of a certain action. The person is expressing their opinion that while the action may be legal in some countries, it is still considered unethical and disregards the importance of ethical considerations. The tone of the comment is somewhat confrontational and critical, suggesting that the person feels strongly about this issue and is frustrated with others who may not share their concerns.",TRUE,
0,"It appears that there is a disconnect in understanding the mathematical inference I presented, as both my initial comment and your subsequent response seem to convey the same message regarding the probable lack of desire among women aged 45 and above to have biological children.",TRUE,
0,"Reddit's ""Red"" feature serves as a means of acknowledging and appreciating valuable contributions made by individuals within the platform, essentially functioning as a virtual token that can be purchased to support content creators and foster engagement within the community.",TRUE,
0,,TRUE,
0,"The assertion that one must generate substantial profits as a landlord in Dublin is emphasized by the notion that the apartment in question will be continuously rented, with no interruptions or vacancies, thereby ensuring a constant stream of revenue.",TRUE,
0,"The Airport is bustling with activity, particularly Terminal 2, where the atmosphere is frenetic and chaotic. Travelers are advised to arrive well in advance, especially those who need to drop off their luggage, as Virgin Atlantic has resorted to setting up temporary check-in desks on the sidewalk outside to accommodate the throngs of passengers.",TRUE,
0,"The crux of the matter lies in the fact that 9GAG prioritizes the provision of amusement and enjoyment, whereas Reddit has a greater focus on effecting transformative change in society.",TRUE,
0,,TRUE,
0,"ESPN maintained that [NAME] was undeserving of praise, asserting that a team under his stewardship should be demonstrating superior performance and actively participating in postseason contention, rather than merely vying for a spot in the playoffs.",TRUE,
0,"It is unfortunate that [NAME] has chosen to perceive this as a personal affront, given that the intention behind the statement was merely to bring attention to the problematic actions and behaviors exhibited by [NAME] himself.",TRUE,
0,"> Individuals who consume alcoholic beverages in quantities exceeding the suggested intake levels, albeit marginally, are often subject to scrutiny and criticism. Indeed, it is a common phenomenon for individuals to perceive such behavior as problematic or indicative of an underlying issue, despite the fact that moderate alcohol consumption can have beneficial effects on health when done responsibly. Therefore, it is essential to approach such situations with nuance and understanding, recognizing that each person's relationship with alcohol is unique and influenced by various factors. By doing so, we can foster a more informed and empathetic discourse surrounding alcohol use and its impact on our lives.",TRUE,
0,"However, if we proceed to visit the FCS at this time and refrain from engaging in future contests against you all at the Cotton Bowl, we will be able to retain possession of the hat.",TRUE,
0,"A colleague of mine had been experiencing a comparable issue, which led me to suspect that a similar solution might be applicable in my case as well. Upon further investigation, it was determined that my colleague required a surgical intervention to alleviate the blockage in her nasal passages, which served as a vital step towards ameliorating her symptoms.",TRUE,
0,,TRUE,
0,"Having completed all necessary preparations, we are now poised to embark on our journey to the Horn, commencing with the weighing of anchor and setting sail forthwith.",TRUE,
0,"Prior to engaging in mathematical computations, it is essential to possess a comprehensive understanding of all relevant factors, as exemplified by the equation 1+1=2, which can be expanded to 1+1(+1)=3, highlighting the significance of considering all pertinent information before performing calculations.",TRUE,
0,"Prepositional phrases and subordinate clauses are conspicuously absent from the article, rendering it difficult to ascertain the circumstances under which the question was posed or the demeanor of the individual involved.",TRUE,
0,"It appears that these individuals are exhibiting a reluctance to engage in a romantic or sexual manner, necessitating the removal of my brassiere and the application of an unconventional technique to stimulate my nipples in order to elicit a response.",TRUE,
0,,TRUE,
0,"It appears that their actions are deliberate, as they have made a conscious decision to prioritize displaying their desired narrative over providing an accurate representation of reality. This shift in focus occurred several years ago, and it seems that they have been steadfast in their commitment to this approach ever since.",TRUE,
0,"Your spouse appears unconcerned about your public image, given that he was the individual responsible for disseminating the false information in the first place. This fact warrants some introspection on your part.",TRUE,
0,"Observe the self-satisfied expression on her visage, which could be interpreted as an implied assertion that she was the culprit, as if she were declaring, ""It was I who was responsible for this outcome, [NAME],"" with a hint of superiority and a dash of playfulness.",TRUE,
1,"Although it's evident that she has a fondness for hosting others, my perception of her remains positive, as her affable nature and hospitable demeanor contribute significantly to the enjoyment of those around her.",TRUE,
1,"I have performed this action while intoxicated in the past, and although I highly doubt it was you, I still extend my sincerest apologies for any inconvenience or discomfort that may have been caused.",TRUE,
1,"As an enthusiast of home decor and culinary delights, I derive immense pleasure from pursuing the social media accounts of various interior designers, National Geographic, and Better Homes and Gardens. The diverse content shared by these sources not only provides me with boundless inspiration for decorating and baking but also fosters a sense of creative exploration that is unencumbered by feelings of guilt or the need for comparison.",TRUE,
1,"Indeed, it essentially provides us with unrestricted authority to contest each and every firearm regulation, which is quite amusing, don't you think, [NAME]?",TRUE,
1,"Sports fixations resemble religious fervor for certain individuals, yet these very persons often ridicule enthusiasts who gather at comic conventions, illustrating a glaring inconsistency in their reasoning.",TRUE,
1,"It is quite amusing that I had a similar notion, as it happens. Your organization has evolved into a multifaceted entity, encompassing a wide range of individuals with varied backgrounds and experiences. The team has adopted an innovative moniker, uniting two cities and their respective fan bases under a single banner. Establishing a state-of-the-art training facility in Wagga Wagga, providing a centralized location for athletes to hone their skills and foster camaraderie.",TRUE,
1,,TRUE,
1,"While my methods may appear unconventional, I take great pleasure in maintaining a tidy and organized environment. In fact, I derive immense satisfaction from engaging in activities that others might deem 'crazy.' However, my primary objective is to enjoy myself and have a good time, even if it means venturing beyond the realm of conventional cleaning practices. Ultimately, I encourage everyone to embrace their unique approach to cleanliness and have fun while doing so, or at the very least, attempt to do so.",TRUE,
1,,TRUE,
1,"The individual known as [NAME] exhibited behavior that was utterly unforeseeable, as they gathered with a group of others in the central area of the ring, eliciting laughter from those present.",TRUE,
1,"The fleeting nature of time becomes increasingly evident as one reaches the age of 18, at which point the passage of time seems to accelerate exponentially, rendering it difficult to comprehend how rapidly the years have elapsed; this phenomenon is often accompanied by the realization that certain life milestones, such as the loss of virginity, may not have occurred as anticipated by the age of 30, leading to a mix of emotions ranging from amusement to disbelief, as exemplified by the statement ""hah.",TRUE,
1,"It is my fervent desire that we emerge victorious in tomorrow's contest, as achieving a triumphant outcome would not only bring us immense joy but also serve as a testament to our dedication and hard work. Reaching the midpoint of the season with a winning percentage of.500 would be an incredibly gratifying accomplishment, as it would demonstrate our ability to maintain a consistent level of excellence throughout the first half of the campaign. Furthermore, securing a victory would also bring me great pleasure, as it would validate our efforts and provide a tangible reward for our unwavering commitment to success.",TRUE,
1,"It is amusing to encounter references to Ph and Tesla engaging in advertising, as they eschew conventional marketing strategies. Any such mentions are therefore noteworthy and enjoyable to observe.",TRUE,
1,"The expletive-laden statement expresses enthusiastic approval towards a situation where an individual was removed from a social gathering due to their minor misconduct, with the speaker finding it amusing and appreciative of the information shared, extending their gratitude towards the informant.",TRUE,
1,,TRUE,
1,"It is rather amusing that you appear to have such a strong dislike for [NAME], despite the fact that you share numerous similarities with them, which I find quite peculiar.",TRUE,
1,"It is amusing to consider that, had he not experienced three consecutive subpar performances, the outcome would not have been remotely close to being secured.",TRUE,
1,"Upon dropping them, your reputation within the youth group was irrevocably tarnished for the remainder of the evening, much to the amusement of those present.",TRUE,
1,,TRUE,
1,"Indubitably, my fascination with sharks stems from a profound fear, which, in turn, has fostered an unrelenting interest in these formidable creatures.",TRUE,
1,"The idea was shared verbatim on the subreddit r/CrazyIdeas recently, and it's intended to be humorous.",TRUE,
1,"What precisely is the rationale behind requiring a 'bargaining chip' when the incremental tariff hike itself, constituting 25%, already seems insufficient to warrant significant concessions in negotiations?",TRUE,
1,"The individual donning a white attire, who nonchalantly leans back while displaying an unfazed demeanor as he receives a particular body part of a person's anatomy in close proximity to his facial region, elicits amusement.",TRUE,
1,"Believe me, it had an immense impact on me; it nearly induced an instantaneous physical response in me, had I been a woman, my panties would have dropped involuntarily, evoking laughter.",TRUE,
1,"The statement "" [NAME] could drown in a glass of water"" elicits a chuckle, but it also underscores the perception that [NAME] is vulnerable or lacking in some fundamental way. Despite this, I have a deep affection for [NAME], even though my viewpoint diverges from the majority opinion.",TRUE,
1,"It is possible that his foot elevates significantly, but I cannot help but laugh at the thought of it. Maybe I'm just blowing smoke, idk much about good QB form.",TRUE,
1,"The proximity of Blue Cheese to the articulation of my lips and tongue is such that it represents the closest approximation of the pronunciation thereof, thereby eliciting a humorous response from me.",TRUE,
1,"It is amusing to witness the act of regarding ""literally"" as a formidable term, accompanied by the misconception that its usage is beyond one's comprehension, thereby exemplifying a remarkable instance of unintentional irony.",TRUE,
1,"I find myself chuckling uncontrollably at the mere thought of this scenario, as if I were an inconspicuous observer, privy to the intimate moments shared between two individuals. My affection for Michael Jackson, much like a fly on the wall, is omnipresent and unwavering, much like the steadfast devotion one would harbor towards a cherished companion, such as [NAME].",TRUE,
1,"The input text draws a parallel between the current situation and a previous encounter involving a female individual, [NAME], and an amphibian creature, in which 7-11 attempted to acquire a specific store number, evoking a sense of irony and humor.",TRUE,
1,"I possessed an individual of such nature, who would engage in acts of plagiarism with my comedic expressions and witty remarks, presenting them as her own creations while in the presence of others, including myself. (LOL)",TRUE,
1,"It is quite amusing that the idea of ""learning"" physiotherapy is being presented as a novel concept, as if Doctor of Physical Therapy (DPT) and Physical Therapist (PT) professionals did not already dedicate three years of rigorous study to master the field.",TRUE,
1,"It is interesting to note that conservative elements seem to reserve their vitriol for women and people of color, a phenomenon that warrants further examination and contemplation.",TRUE,
1,,TRUE,
1,"It appears that you are inferring that I possess qualities of vulnerability and submissiveness; however, I must correct you by pointing out that it is, in fact, you who embodies the definition of a 'cuck' in this context, as your behavior resembles that of a young, inexperienced, and unsuccessful individual who resorts to name-calling and personal attacks rather than engaging in constructive dialogue.",TRUE,
1,"The mental image of you experiencing an unfortunate concatenation of events, specifically sneezing and subsequently colliding with your cranium, triggered within me an uncontrollable fit of laughter, which served as a much-needed respite from the monotony of my day. However, I must caution you that such boisterous merriment could potentially lead to undesirable consequences, and thus, I implore you to maintain a state of tranquility and refrain from further disruptive behavior.",TRUE,
1,"The sentiment expressed in the original statement is one of incredulity, as the speaker struggles to comprehend why someone would seek donations for the purpose of generating a substantial profit through an ATM business venture. The tone is somewhat derisive, with a hint of sarcasm, as the speaker implies that the individual in question is attempting to take advantage of others' generosity for personal gain. In essence, the statement conveys a sense of disbelief and skepticism towards the motives behind such a request.",TRUE,
1,"My apologies for the misunderstanding; I did not intend to imply that one of my romantic partners was involved, but rather, I was referring to one of his possessions or belongings. To clarify, we are not in an open relationship.",TRUE,
1,"The sentiment expressed in my previous statement, with which I concur, pertains to the notion of seeking alternative accommodations, an endeavor that elicits mirth and serves as a source of amusement, albeit momentarily.",TRUE,
1,"As far as I can say, my cherished limb has been restored to me, much to my delight and amusement. I shall certainly keep you informed of any further developments and advancements in my recuperation. Until our next encounter!",TRUE,
1,"The humorous aspect of this situation is evident, as I have personally acquainted with numerous individuals who exemplify the aforementioned stereotypes.",TRUE,
1,"When my egg cracked, I underwent a series of emotional phases akin to those typically experienced by teenage girls, but condensed within a two-month period, which was quite an amusing and tumultuous experience for me.",TRUE,
1,"My affection for canned black beans is exemplified by the expediency with which they can be prepared in the microwave, requiring merely a minute and forty-five seconds of my time, which, coupled with their delectable taste, renders them an ideal component of a quick and satisfying meal, eliciting from me a playful expression of amusement.",TRUE,
1,"( Õ°¬∞ Õú ñ Õ°¬∞) It is evident that you are aware of your current situation, and I wager it's utterly devastating to be thoroughly discredited and humiliated on the world wide web, eliciting a response akin to ""hahaha"" from those who witness your downfall.",TRUE,
1,,TRUE,
1,"The reference to Snoop at the conclusion of the article served as a poignant reminder of the iconic Chappelle's Show episode featuring [NAME], which utilized biting satire to highlight the pervasive and problematic nature of racism in our society.",TRUE,
1,"This is a comment made by someone on social media, in response to a post or tweet that they found amusing. The person is expressing their surprise and delight at the humor they have encountered, specifically citing the length of time it took for the joke to build up to its punchline.",TRUE,
1,,TRUE,
1,,TRUE,
1,"My initial reaction was one of utter amazement, as I exclaimed, ""Wow!"" followed by an enthusiastic affirmation of the item's aesthetic appeal, stating that it looked great! I am eagerly looking forward to the possibility of acquiring authentic vintage jerseys similar to the ones depicted in the future, with the intention of adding them to my collection. I habitually monitor online marketplaces such as eBay, vigilantly searching for rare and unique items that align with my interests and preferences.",TRUE,
1,"It is amusing to note the prevalence of conspiracy theories surrounding moderators and their perceived intentions to undermine the very foundations of the community they serve. Indeed, it appears that some individuals harbor the belief that these appointed authorities are hell-bent on destroying the subcommunity, a notion that, while misguided, speaks volumes about the inherent distrust and skepticism that often accompanies the exercise of power and authority within online social contexts.",TRUE,
1,"As I descended from my psychedelic excursion, I had the privilege of witnessing an extraordinary athletic performance, one that left me in awe and cemented my admiration for [NAME], whose enchanting display on the field solidified their status as a legend in my eyes. Even now, I proudly don their jersey, a tangible reminder of the unforgettable experience and my enduring reverence for their exceptional skill.",TRUE,
1,"I possess a 4K screen, which I find quite amusing; additionally, I was previously unaware of the possibility of creating personalized CSS rules, but thanks to your assistance, I have gained valuable insight into this feature.",TRUE,
1,"While I have been diligently working on mastering this particular map, I must admit that my skills still fall short of the proficiency level required to execute it flawlessly, as my performance continues to be plagued by minor errors and inconsistencies. Despite this, the map remains one of my favorites, and I am determined to persevere in my efforts to improve my abilities and ultimately conquer it.",TRUE,
1,"It's an entertaining narrative, my dear fellow, that you've shared with us, recounting a chaotic episode that involved uncontrollable vomiting, which, I must say, is quite an unfortunate experience, especially when it occurs in public and in close proximity to unfamiliar individuals. The mere thought of it is enough to elicit a chuckle from me, and I'm sure it will have a similar effect on anyone who reads it. Well done!",TRUE,
1,"The statement you made resonates with me, and I concur that attending a few matches and sharing the experience with like-minded individuals could enhance my enjoyment of the game.",TRUE,
1,"The laughter emanating from my being elicits a sense of amusement, but unfortunately, the discomfort associated with this situation will not diminish with the passage of time, and I must extend my sincerest apologies for the inconvenience it may cause.",TRUE,
1,"This is the inaugural instance wherein I have experienced a genuine laugh, rather than a mere amused nasal exhalation, while perusing the content on this platform.",TRUE,
1,"Here, we, as individuals, are metaphorical open books, transparent and vulnerable in our communication, unreservedly sharing our innermost thoughts and feelings, often with a touch of humor, as we engage in conversations that convey unfiltered, raw, and frequently amusing veracity.",TRUE,
1,"It is quite amusing that you are attempting to convey your intended message in a manner that is not entirely clear, as if you are saying, ""My apologies for the confusion caused by autocorrect; it seems it replaced my original phrase with 'let's do SOCKS,' which was not my intention.",TRUE,
1,"The response elicited a chuckle from me, and my apologies for the unfortunate encounter with an inconsiderate individual. I hope the damage to your vehicle is not extensive and can be adequately rectified.",TRUE,
1,"In the event that nine out of ten females were to dismiss my advances, I would endeavour to engage with twenty individuals, as this scenario resembles a threesome.",TRUE,
1,"It would be futile to engage with him in any meaningful way, as he exhibits a callous disregard for objective reality and displays a pronounced bias towards those who hold differing opinions, rendering any potential interaction unproductive and unfulfilling. His archaic and bigoted worldview is rooted in an unyielding ignorance, manifesting in a stubborn refusal to acknowledge verifiable evidence and a tendency to dismiss opposing viewpoints with flippant disdain, thereby perpetuating harmful stereotypes and reinforcing damaging gender roles.",TRUE,
1,"It appears that the argument regarding the payment of federal workers has been rendered moot, much to the chagrin of those who were eager to exploit it for political gain. The irony of the situation is quite amusing, and it's interesting to note how quickly the narrative has shifted.",TRUE,
1,"The information regarding [NAME]'s victory at the Australian Open has already been documented on their Wikipedia page, much to the amusement of those who have discovered this humorous addition.",TRUE,
1,"The sentiment expressed in the statement that numerous individuals harbor unfavorable views towards wiki edits, yet the majority of these modifications elicit a fleeting amusement or mirth in the speaker, is one that warrants further examination and introspection. It is worth considering why it is that so many people feel compelled to criticize or disparage the efforts of those who contribute to collaborative projects such as wikis through editing, and whether there may be ways to address this issue and foster a more positive and supportive community environment. At the same time, it is also worth acknowledging that even in the face of criticism, the humor and irony inherent in certain situations can still serve as a source of levity and enjoyment for those involved. Ultimately, the interplay between these various factors highlights the importance of maintaining open lines of communication and a willingness to engage in constructive dialogue within any given community, in order to promote understanding, respect, and collaboration.",TRUE,
1,"The query that arises is why I appear to reach a plateau at a depth of 6/7, with the inability to delve any further without experiencing nausea. Moreover, it appears that my body is unable to withstand the pressure at greater depths, as evidenced by the frequent occurrence of vomiting whenever I attempt to do so. Furthermore, my desire to explore and experience more profound depths is hampered by these physical limitations, which can be a source of frustration and disappointment, as expressed by the abbreviation 'FML' and the emoticon 'lol'.",TRUE,
1,"Moreover, it reinforces the notion that discipline and habit are sustainable only when consistently practiced and maintained, a concept that I find somewhat amusing.",TRUE,
1,"It is evident that [NAME] possesses inherent worth, as demonstrated by yet another instance of their value. This moment serves as a testament to their importance and underscores the significance of their presence. Furthermore, it is amusing to note that [NAME] has a small penis, which adds to their unique charm and individuality.",TRUE,
1,"It is highly unlikely that anyone would back this legislation, regardless of their political affiliation or ideological leanings, as it would effectively neuter the CIA and FBI's ability to engage in covert operations and intelligence gathering, ultimately compromising national security.",TRUE,
1,"If one takes the time to carefully examine the situation, it becomes apparent that the true essence of the joke lies in the fact that individuals are engaging in futile conflicts on the internet, with no tangible purpose or reward to show for their efforts.",TRUE,
