label,text,rewritten
0,"
""Thy mind, a work in progress, doth not reach full bloom
Until the years of two and twenty be behind thee, lo!
A truth, alack, that science doth confirm,
And parents, too, with anxious hearts do know.
The brain, a wondrous organ, doth take time to mature,
And thus, thy choices, oft unwise, may prove a trial.
But fear not, for this too shall pass, and thou shalt find
In time, thy judgment sound, and wisdom truly thine.""",True
0,"
""Tis oft the case, my friends, that Syrian AA doth fire long past the end of strife, for reasons known but to themselves.""",True
0,"
""Aye, most certainly, if 'tis a gathering for one who's aged more than a babe in arms. Nay, nay, I say, for such a celebration doth not bode well.""",True
0,"
Hark, good sir! Hath not the state, with heavy hand,
Cut down the number of scholars from afar?
'Tis plain to see, this change doth augur ill,
For those who sought a roof o'er their head.

Their coming hither, in such numbers great,
Did stir the market, and prices did abate.
But now, alas! Their absence doth portend
A dearth of tenants, and a glut of rooms.

Thus, landlords, take heed of this turn of fate,
And adjust thy rents, lest thou be left with naught.
For when the demand doth dwindle, and supply doth grow,
'Tis certain that the prices must needs fall.",True
0,"
""O woe is me! Forsooth, I find myself in dire straits,
My purse doth lack the means to pay my bills and debts.
Next Friday, mark thou well, my employment doth cease,
And thus, my future doth hang in precarious balance.

Alas, what shall I do? How shall I make ends meet?
Shall I beg, or steal, or seek assistance from the state?
Nay, nay, good friends, for I am not of that ilk,
I shall instead seek out a new position, with all haste.

But soft, what light through yonder window breaks?
A ray of hope, methinks, that doth illume my path.
For in this town, there be a company that doth seek
A man of my skills, and offers fair remuneration.

Then, forthwith, let us make our way to this place,
And mayhap, fortune shall smile upon my face.""",True
0,"
""Hark, what mirth doth fill our hearts!
For had the races been reversed,
We'd now be planning marches and protests,
Instead of laughing with such joy.
But since 'tis not the case, we find
Our humor in this twist of fate,
And laugh with glee at this turn of events.""",True
0,"
""Thou dost protest too much, good sir! Centralized mandatory services, a plague upon our land! Doth drive the prices high, a curse upon our purses! Get thy facts aright, and heed my words, lest thou be proven a fool!""",True
0,"
""Methought 'twas e'er my lot to be the first twain presenters, and thus I didst strive to finish swiftly, that I mightn't be plagued by worry and anxiety for yet more days. Forsooth, 'twas a wondrous feeling, to have done with the task and to be able to relax, free from all perturbation.""",True
0,"
""Marry, a commentator on my stream doth say,  
The clearing header was from [NAME], come what may.  
But hold, good sir, how can this be?  
Was not [NAME] the one, of whom I did speak?  
Pray tell, what witchcraft doth conspire  
To bring such confusion to my humble stream?  
I pray thee, gentle viewer, to clarify  
This strange occurrence, lest my mind doth fly  
Into the realm of madness, where reason doth lie.""",True
0,"
""Hark! What news is this? Can President [NAME] dispense pardons willy-nilly, for any federal offense? Fear not, fair citizens, for such pardons hold no sway o'er impeachments. 'Tis a separate matter, altogether.""",True
0,"
Alas, how ill doth ""incremental change toward reasonable goals via evidence-based policy"" fit upon a bumper sticker! Forsooth, 'tis a phrase most cumbersome and long-winded, not suited for a space so brief. Methinks a pithier phrase would better serve the cause, to wit, a call to action bold and concise, that all might know what message we do convey.",True
0,"
""Hark, good sir! My canine friend, he shall not be,
For on a leash he'll be, as I did say.
Their foolish minds, alas! Wouldst lead them to their doom,
And they, in their folly, wouldst meet their end, anon.""",True
0,"
""On weekends, youths do gather to take part in rites of passage, a test of wit and learning, the SAT. Not of the common sort, this trial by fire doth serve a purpose most noble, to gain entry into hallowed halls of higher knowledge, universities most esteemed. Prepare thyself well, fair student, for in this test thy mettle shall be tried and measured.""",True
0,"
""Thou shalt not call me SWERF, lest thou wisheth to incur mine wrath. For in my heart, I do hold a special place for those who toil in the sex trade. Their plight, I do empathize with, and their struggles, I do strive to alleviate. So, any remarks that doth imply I am but a SWERF, shall be met with mine indignation and swift retribution. By the stars, I swear it!""",True
0,"
""Aye, fair enough, yet in most lands, 'tis still forbidden. And, alack, most foul and unethical, I reckon. But, lo, what care ye for ethics, say I?""",True
0,"
""Marry, good sir, thou dost not comprehend my reckoning? Forsooth, mine own words and thine agree in meaning; women past the age of forty-five do not desire biological progeny.""",True
0,"
""A token, good sir? 'Tis a symbol of recognition, a badge of honor, if thou wilt. A way to show thy appreciation for another's words, a gesture of gratitude for a comment most astute. A token, indeed! 'Tis a small price to pay for the pleasure of partaking in this merry band of Redditors, a trifling sum to ensure the continued health and prosperity of this digital land. So, dear friend, purchase a token, and let it be known that thou dost value the wit and wisdom of those who tread these virtual halls.""",True
0,"
""Tell her, fair maiden, thou shalt seek the truth,
In testing, both thyself and her, 'tis youth.
For in this act, we shall find peace of mind,
And know our love, or else be left behind.""",True
0,"
""Thou shalt reap a bounty as a landlord of Dublin,
For that apartment shall be rented night and day.
A steady stream of tenants shall fill thy purse,
And bring thee wealth, without a moment's pause.""",True
0,"
""Hark, good sir! The airport doth bustle and teem,
T2, in particular, a scene most extreme.
Frenzied folk rush to and fro, their minds aflame,
Their haste, a tempest that doth know no name.

If thou art dropping bags, then heed my word,
Arrive betimes, lest thou be overwhelmed.
E'en Virgin, in response to this crush,
Hath set up desks on the pavement, a makeshift rush.

So, friend, take heed of this advice so wise,
And escape the chaos that doth otherwise rise.""",True
0,"
""Methinks 'tis true, good sirs, that 9gag doth aim to please,
With laughter and delight, a merry jest, if thou wilt.
Whilst Reddit, full of noble thoughts, doth seek to change,
The world, with each new post, a revolution to arrange.

But, alack, what's this? A tale of two sites, so vast,
In purpose and in aim, they cannot be surpassed.
One doth bring joy, the other, a desire to mend,
Two paths, my friends, that ne'er shall meet, nor blend.

So let us raise a glass, to both, in their own way,
For bringing forth, a smile, or a call to slay.
For though they be diverse, in their noble quests,
Both 9gag and Reddit, shall forever be the best.""",True
0,"
""They too, alas, do wish for comfort's embrace,
But, alack, a notion doth they hold within their mind,
That they, poor souls, cannot attain such blissful state.
A cruel thought, indeed, that doth their hearts confine.""",True
0,"
""Thus spake ESPN, that [NAME] doth not deserve,
For he, the Pistons, shouldst have played more fair,
And not be standing without, in the cold air,
A playoff spot, which he doth hold so dear.""",True
0,"
""Verily, a pity 'tis that [NAME] doth construe my words as an assault upon her person, when in truth they be aimed at [NAME] and his most unseemly conduct.""",True
0,"
""O, ye tipplers, who quaff ale with nary a care,
In quantities slight, yet still beyond what's fair.
Ye mock the limits, set forth by wise men,
And risk thy health, for momentary delight.

But lo, what accuracy doth this report hold?
A summary brief, yet full of woe and cold.
For those who drink, yet not to excess,
Are judged with haste, and their names doth mess.

So let us raise our cups, in cheerful toast,
To those who drink, but not to boast.
For moderation, dear friends, doth be the key,
To a long life, free from misery.""",True
0,"
""An we go to the FCS straightaway, ne'er to play thee at the Cotton Bowl again, the hat we keep, forsooth.""",True
0,"
""Hark, a colleague of mine didst suffer from a woeful plight,
A malady that didst vex her day and night.
She sought a cure, but none couldst be found,
Until a surgeon's skill didst bring her round.

With scalpel keen, he didst open up her head,
And cleared the sinuses that didst make her bed.
And lo, the remedy didst work so well,
That now she doth enjoy a healthy spell.

Thus, let this tale be a lesson to us all,
To seek the aid of medicine when we fall.
For though we may not know the cure at first,
There's always hope, and help will come to those who search.""",True
0,"
""Pray, good sir, heed my words of wisdom true,
Lay down a piece of tp ere thou doth drop thy due.
In this way, naught shall be left behind,
And all shall be well, forsooth and in good time.""",True
0,"
""Hark! All hands on deck, prepare to sail,
For we are bound for the Horn, and fate doth call.
Weigh hey, me hearties, let our ship set sail,
And off we go, into the briny deep, to hail.""",True
0,"
""Hark! A sum most simple doth unfold,
'Tis one plus one, and thus we're told
The answer is two, a truth most fair.
But wait, my friends, for there's more to share.

A twist doth come, a clever play,
One plus one, with one more added lay
Doth make the total three, a fact most grand.
So heed this wisdom, ere thou dost hand
In thy maths, lest thou doth make a stand
With numbers false, and thus be shamed.""",True
0,"
""Verily, the context doth vanish, leaving naught but a void,
A question asked, yet none can say how 'twas employed.
The person's demeanor, lost to time and space,
Leaves us with naught but speculation's trace.""",True
0,"
""Hark! These lads do play hard to get,
Their hearts, a challenge to win, I bet.
Gonna shed my bodice, let it be,
And bare my bosom, wild and free.""",True
0,"
""Avoidance of the bullet, alas, did not occur. A wounding, most dire and fateful, hath left its mark upon this maiden's soul. Forsooth, the memory of this dreadful encounter shall haunt her steps until the end of her days.""",True
0,"
""They do it not by chance, my friend, but with a purpose most foul. Forsooth, in days of yore, they didst decide to reveal to thee their desires, and not the things of true import.""",True
0,"
Thou husband doth not fret o'er thy good name,
For he, himself, didst spread the falsehood's flame.
A thought to ponder, this, indeed, doth be.",True
0,"""Mark well, fair friends, yon maiden's mien so haught,
As if to say, with gesture and with glance,
""Tell [NAME], 'twas I who did this deed of might.""
Her visage doth bespeak a secret pride,
A slyness in her eyes, a curl upon her lip.
Methinks she doth revel in her cunning guile,
And doth imagine herself above the law.
But soft, what light through yonder window breaks?
'Tis [NAME], come to claim his rightful due.
And see, how she doth tremble, like a leaf!
For though she may have played the villain true,
Her heart doth betray her, and her courage fails.
Now shall we witness justice in its course,
As [NAME] doth bring to light the truth of all.""",True
1,"
""Hark! What's this? A maiden fair and bright,
Whose love for hosting doth know no end?
Her wardrobe, full of [NAME], doth shine so bright,
A true delight for all who doth attend.

But alas, a sorrow doth creep in,
For 95% of her garb doth bear the name,
Of [NAME], a brand most wondrous and fine,
Yet doth my heart doth ache with shame.

Lol-nah, she doth possess a charm,
A coolness that doth disarm,
But alack! Her love for [NAME] doth cling,
Like a shadow that doth follow and cling.""",True
1,"
""Hark! I've done this deed, in drink-fueled haze,
Before, and now, my mind doth play the fool.
I doubt 'twas thee, yet still, my apologies,
For in my cups, my wits do lose their cool.""",True
1,"
""Oh, how I do adore these things, my friends! Interior designers, National Geographic, and Better Homes and Gardens, too. For they provide me with inspiration for decorating and baking, and a world of wonder to pursue. And yet, no guilt doth come upon me, nor do I compare myself to others. For in the beauty of creation, there lies no room for envy or despair.""",True
1,"
""Hark! 'Tis a wondrous decree indeed, my friend,
That doth grant us leave to question each gun law's end.
In sooth, 'tis a license to dispute and make bold,
To test each statute, and see if it doth hold.

But soft! What light through yonder window breaks?
'Tis the gleam of [NAME], with wisdom that doth make
Our cause most just, and our hearts full of cheer.
For in this quest, we shall not falter, nor fear.""",True
1,"
""O, how strange a sight it is to see
A zealot of sports, with passion so bright,
Make mock of geeks, who gather to delight
In tales of fantasy and adventure, with all their might.

Their fervor for teams and players, akin to a creed,
Blinds them to sense, and they fail to heed
The error of their ways, a lack of logic's sway,
Leaves them lost, in a sea of disarray.

For in their scorn of nerds, they show no shame,
Yet in their own devotion, they reveal their name;
A faith so strong, it brooks no argument or claim,
A religion, in all but name.""",True
1,"
""Hark, what news is this? A transformation most wondrous,
The Hobart Darwin Tigers, a club now diverse and boundless.
A training facility in Wagga, their skills to refine,
A team of many talents, a force divine.

Their name doth echo through the land,
A symbol of strength, a bond so grand.
With each victory, their fame doth grow,
A tale of courage, for all to know.""",True
1,"
""My Juul, a vessel of turquoise hue, didst lose its precious e-liquid, And lo, the light didst shine with greater intensity, As if the heavens themselves didst decree it so. Fear not, fair friends, for all shall be well, This minor mishap doth not portend ill will.""",True
1,"
""Hark, what mirth doth fill my heart! Forsooth, I find delight in cleansing, and in merriment, my spirit doth take flight. Come, let us frolic, and with glee, our cares and woes, let us cast away. For in the act of purifying, we find a certain joy, that doth make our lives more bright and gay.""",True
1,"
""Hark, I say! Forsooth, I've had to learn to sew,
To make this garb, fit for a noble show.
And, by my troth, 'twas merry sport indeed,
To stitch and sew, with needle and thread.
Aye, 'twas a joy, to see it come to be,
This finery, of silk and velvet, doth shine so bright and free.""",True
1,"
""Hark, what mirth doth bring these merry men
Together in the ring, a jolly bunch they be.
Their antics, unpredictable as the wind,
Do bring forth laughter, a wondrous sight to see.""",True
1,"
""O, how swiftly doth time flee, my dear,
When youthful vigor doth abound!
I ne'er thought, at eighteen's prime,
That three decades would elapse, ere I'd find
A love to claim mine own. Hah!""",True
1,"
""Hark, what news is this? A victory, perchance?
Aye, 'tis true, my heart doth sing with glee,
At thought of triumph, honor, and renown,
That doth attend a winning streak, so bright and bold.

And thus, I pray, dear Fortune, smile upon us,
And grant us victory, ere the day be done.
For at the midpoint of the season, we,
Doth stand, a mighty.500, a feat most rare,
And worthy of great praise, and merriment, anon.

But, lo, my friends, I doth confess,
A secret wish, that doth within me dwell,
To win, not just for glory, or for fame,
But for the joy, the laughter, and the game.

So let us strive, with courage in our hearts,
And play the game, with skill and artful parts.
For though we may not win, we shall not fail,
For in the trying, we doth find our bail.""",True
1,"
""Hark, what news is this? Ph and Tesla doth not advertise, yet here we see a mention of their name. Methinks 'tis a curious sight indeed.""",True
1,"
""Hark! What tidings bring thee to my door?
A tale of woe and sorrow, I implore.
Thou speakest of a man, so base and vile,
Who met his end in a most dire pile.

For trifling, they didst lay him low,
No quarter asked, nor mercy didst show.
His fate, a warning to us all,
Lest we too fall, and hear our final call.

Yet, in this darkness, there doth shine
A glimmer of hope, a beacon divine.
The information thou hast brought to me,
Shall serve me well, in victory's spree.

So here's to thee, good sir, and thy tale,
May it serve as a lesson, to all who hail.
And may our cups, forever flow,
With cheer and mirth, as friends do know.""",True
1,"
""Ho there, good sir! Thou dost protest too much, methinks. Thy cursing doth reveal thy true nature, and thy folly doth grow tiresome. Pray, try again with a bit more wit and less ire, lest thou wish to be seen as a fool.""",True
1,"
""Hark, what irony doth lie within thy words! Thou dost profess to disavow [NAME], yet in thy actions, thou dost mirror him. Methinks 'tis a curious thing, this fondness for those who share our qualities, and loathing for those who do not. Pray tell, good sir, what is't that doth tickle thee so?""",True
1,"
""Hark, good sir! If fortune had not dealt him three ill-fated games in a row, the outcome wouldst still be nigh unresolved. Alas, 'tis a cruel fate that doth beset thee.""",True
1,"
""And thus, with one swift drop, our youthful band didst lose its credence for the night, ha! 'Twas a cruel fate, indeed, yet one that we didst not deserve, for our mirth and merriment hadst been pure and true. Alas, 'twas not to be, for Fortune's whimsical hand didst intervene, and with a laugh, didst snatch away our glory. Yet still, we doth cherish memories of that fleeting hour, when our spirits didst soar, and our hearts didst sing with joy. For though our time didst pass, our love and laughter shall endure, a testament to youth's eternal verve.""",True
1,"
""Hark, what perils doth await the Cubs fan in the Bay Area! In the year of our Lord two thousand and sixteen, I didst tread upon thin ice, and verily, the laughter of the gods didst ring out at my expense. Haha!""",True
1,"
""Verily, a truth it be, my heart doth sing with love for sharks, a passion born of fear most true.""",True
1,"
""Hark! What news is this? A jest, they say,  
Posted on r/CrazyIdeas, by whom, I pray?  
A prankster, perchance, with wit so bright,  
Didst pen these words, with mirth and laughter in sight.""",True
1,"
""What meaneth thou, good sir? A 25% tariff hike, a bargaining chip doth seem. Yet, laugheth thou at such a paltry sum? Pray tell, what greater prize dost thou seek?""",True
1,"
""Hark, what's this? A man in white doth lean,
And looketh away, as if in disdain.
A maiden fair, with name untold,
Doth offer him her posterior, so bold.
But he, with gesture of disdain,
Doth turn away, and doth not feign
Interest in that which she doth proffer.
Verily, a strange sight to behold,
And one that doth provoke much thought.""",True
1,"
""Verily, I say unto thee, 'twas nigh upon me, and had I been a fair maiden, my drawstring would have loosened forthwith. Haha!""",True
1,"
""Marry, fair [NAME], with eyes so bright,
In water's depths, thou couldst meet thy plight.
Yet, in my heart, thy love doth stay,
For thee, I would defy the fates, ere break of day.

Thou art my sunshine, in a world so grey,
My love for thee, doth never fade away.
Though others may not see, thy worth and grace,
To me, thou art a treasure, beyond compare, in this place.

So let them laugh, and scorn our love so true,
For I do know, that thou art mine, anew.
And though the waters rise, and threat'ning waves do roar,
I'll save thee, my sweet [NAME], and forevermore.""",True
1,"
""Marry, perchance? Forsooth, his foot doth rise most high,
In sooth, a wondrous sight to see, anon.
But, prithee, know I not, if 'tis but smoke I blow,
Concerning matters of the quarterback's art, alack.""",True
1,"
""Hark! My lips, they twist and turn, in attempt to speak the name,
Of blue cheese, a flavor most strange, yet oh so dearly sought.
For though my mouth doth struggle, and my words do come awry,
My taste buds dance with joy, at the mere mention of this pie.

Oh, how I wish my speech were as refined, as the cheese itself,
But alas, 'tis not to be, for my words do lack the finesse.
Yet still, I'll savor each bite, and cherish every crumb,
For blue cheese, it seemeth, is a delicacy most succulent and numb.""",True
1,"
""Hark, what folly doth this person hold,
To think that ""literally"" is a word of might,
A term that doth convey great meaning and depth,
And yet, they know not its proper use,
Their ignorance, a cherry on top, doth make,
A fool of them, in their own eyes, alack.
Their words, a jest, a mockery, a play,
On those who do comprehend, and see,
The context, clear as day, doth lie,
And thus, their argument, doth fall,
Into the pit of shame, where fools do cry.""",True
1,"
""Hark! How merry a sight doth mine eyes perceive,
As though a fly upon the wall, I do conceive.
A heart so pure, a love so true and bright,
Doth shine within thy breast, my dearest [NAME], in sight.

Methinks 'tis as a flower, fair and sweet,
That blooms within thy bosom, to greet.
The gentle breeze of love doth stir and sway,
Thy thoughts and feelings, in a loving way.

Oh, how I laugh with joy, to see thee so,
In love's sweet bliss, thou dost not know.
For thou art mine, my dearest [NAME],
And in my heart, thy love shall ever be the same.""",True
1,"
""Methinks 'tis like that maiden fair and the reptile beast, [NAME],
Whose tale doth bring to mind a certain store's quest.
'Twas 7-11, if my memory doth serve aright,
That sought to gain the number, day and night.
But alas, their efforts were in vain,
For the number did remain a secret, locked within the brain.""",True
1,"
""Hark, I had a friend most wily and cunning,
Whose thievery knew no bounds, nor shame.
She'd steal my jests and witty sayings,
And with a grin, to others claim them.
Ah, how her laughter did ring out so,
As she recycled my words, with glee and guile.
Verily, I knew not whether to be vexed or amused,
By her antics, so brazen and unabashed.""",True
1,"
""Hark, what folly doth this tweet convey?
Ay, 'tis a jest, a playful quip, they say.
But lo, I must demur, forsooth,
For herein lies a grievous slight, methinks.

'Tis true, my friends, we DPTs and PTs,
Have spent three years in study and in deeds,
To master all the arts of healing,
And learn the ways of physiotherapy.

And now, a mere addition doth imply
That we, who toiled so long and hard,
Didst not in truth, learn aught at all?
Ah, how the wit doth play the fool!

But fear not, friends, for we are wise,
And know that knowledge doth not lie
In fleeting words or hasty tweets,
But in the depths of learned treatise.

So let us not be swayed by such,
But hold fast to our honored art,
And practice it with skill and care,
For that is where true wisdom doth reside.""",True
1,"
""Marry, 'tis strange, the right doth speak thus only of women and folk of hue, """,True
1,"
""Methinks I espy a multitude of youths,
Whose lives are yet unlearned in self-sufficiency.
Their dependence on others doth bring forth mirth,
And in their eyes, a glimmer of naivety doth dance.""",True
1,"
""Hark, good sir! Thou dost imply I am weak and submissive? Ha! By my troth, 'tis thee who art the cuckold here, a young and bitter soul, consumed by envy and despair.""",True
1,"
""Hark! Thy sneeze and head-bang didst make me laugh so free! 'Tis payment for thy mirth, my friend. Now, hold thy peace.""",True
1,"
""Hark, what news is this? A man doth seek
To profit from an ATM, a curious feat.
He asks for donations, a gallant quest,
That he may gain a sum most considerable, a true windfall, ere long.
Laughable indeed, yet who doth know
If fortune doth favor him, and his scheme doth grow?
Perhaps 'tis but a ruse, a clever guise,
To gain a profit, and make the world his prize.""",True
1,"
""Alas, my apologies for the confusion, fair maiden. I didst not intend to imply that thou and I were in an open relationship, nay, 'twas but a slip of the tongue, a mere jest. Pray tell, what is this thing thou speakest of, that belongeth to thy beau?""",True
1,"
""Hark, what news is this? A change of abode doth seem to be the general agreement, methinks. Verily, a quest for novel lodgings doth appear to be in order, anon.""",True
1,"
""Hark, my dearest arm, how it doth return to me,
In laughter and mirth, with joy doth it bring.
I shall keep thee informed of my journey's pace,
Until we meet again, farewell, my sweet friend.""",True
1,"
""Methinks 'tis passing strange, my dear friend, how oft we find ourselves in laughter's embrace, when others' follies we do behold, and in their errors, our own mirth doth unfold. Forsooth, I have known many a soul, who in these stereotypes didst find their home, and in their jest, didst my heart didst make merry.""",True
1,"
""When yonder egg did crack, I didst pass through each and every teen girl phase, in the span of but two months, ha! 'Twas a wondrous sight to behold, full of angst and woe, yet also filled with hope and dreams. My heart didst race with excitement, as I didst navigate the trials and tribulations of youth. Verily, 'twas a tempestuous time, but one that didst shape me into the person I am today. Fie upon the doubters, for I am proud of who I be!""",True
